ad_id,user_id,title,price,description,car_id,date_posted
264,400,Asli Pakai Mesin Stnk Nego,850000000,In voluptas perspiciatis rem ab occaecati amet praesentium. Quod dolores minima vitae alias.,120,2023-02-10 22:19:34
265,359,Original Bekas Bukan rental Dp Dokumen,212500000,Esse corrupti cum id.,103,2023-04-17 12:10:31
266,160,Langsung Siap Berkualitas Velg Terjamin Ban,130000000,Natus ea sed suscipit exercitationem dolor. Dolores iste debitis eos necessitatibus unde.,80,2023-01-27 04:11:33
267,215,Mulus Interior Kendaraan Pribadi Oli Berkualitas,159000000,Atque doloribus deserunt. Non officia corrupti nobis iusto quam.,118,2023-04-21 04:17:08
268,160,Cat Bukan rental Jual Siap Murah Kendaraan Interior,1500000000,Modi hic est adipisci. Delectus numquam iusto dolor magnam.,154,2022-12-22 01:40:25
269,268,Cat Km Baru Pribadi Surat Pajak Service Dp Velg,215000000,Aspernatur beatae velit. Provident quis error. Laudantium dolores asperiores eligendi dolores corrupti aspernatur.,121,2023-01-01 03:18:11
270,28,Langsung Jarak Nopol Tahun Berkualitas Surat Warna Terawat,199000000,Ad similique fugit labore. Repellendus voluptate ipsa molestiae quis eveniet. Fugit rem quos.,86,2022-12-11 16:17:18
271,39,Bekas Siap Oli Dp Full Tahun Cat Langsung Jarang Eksterior,1980000000,Pariatur placeat quod expedita laboriosam vitae odit. Modi corrupti voluptatem aliquam. Temporibus praesentium facere sunt quisquam odit voluptatum.,67,2023-03-29 03:18:48
272,66,Kilometer Tangan Mulus Ban Siap Pakai Eksterior,600000000,Quo et voluptate. Sint fuga consequuntur iure.,140,2023-01-02 18:33:19
273,322,Tahun Pajak Kendaraan Terjamin Dokumen,245000000,Quo minima excepturi itaque qui libero. Recusandae officiis aspernatur similique unde magni architecto.,136,2022-10-11 06:31:20
274,7,Service Cash Jarang Kendaraan Mulus Terawat Pemakaian Berkualitas,146000000,Tenetur eaque voluptatem incidunt. Recusandae quo illum maiores suscipit officiis. Consequatur temporibus repudiandae culpa vero facilis.,143,2023-01-06 21:00:29
275,386,Stnk Tahun Bekas Pribadi Murah Tangan Kendaraan Nopol,1745000000,Corrupti perferendis accusantium enim. Omnis et cupiditate necessitatibus vero est. Voluptates magnam dolor voluptatibus.,32,2023-05-10 19:31:01
276,136,Bekas Oli Pribadi Jarang Cash Stnk Jual Dokumen Eksterior Nopol,155000000,Quisquam magnam velit consequatur expedita distinctio provident. Deserunt illo officiis veritatis dolor eaque. Iusto reiciendis cum sunt dolores.,113,2022-12-13 17:47:30
277,358,Jarang Mobil Mesin Kilometer Bukan rental Mulus,167000000,Totam corrupti sequi odio error. Voluptatum aperiam ullam nihil impedit quidem sint.,73,2023-03-11 11:04:05
278,144,Jarang Dp Interior Murah Nopol Surat,159000000,Harum amet culpa. Nisi ex ea. Reprehenderit in ea iusto dignissimos.,43,2023-06-30 19:52:24
279,277,Eksterior Nego Pakai Jarang Surat Pemakaian Ban Cicilan Asli,485000000,Minus ab nisi beatae neque. Laudantium voluptas tenetur eius.,75,2022-11-09 10:03:48
280,336,Terjamin Ban Pemakaian Bukan rental Kilometer Mulus Tangan,260000000,Nisi laudantium fuga dicta vel adipisci. Incidunt molestiae iusto asperiores saepe quos repellat.,200,2022-12-22 18:33:51
281,300,Eksterior Interior Langsung Warna Mesin Pemakaian,899000000,Ipsam doloribus illo fugit similique quibusdam. Earum nobis vero nobis repudiandae dolorem.,164,2023-03-22 06:47:00
282,296,Tangan Warna Nopol Km Pribadi,899000000,Dicta accusamus porro saepe. Aut nisi accusamus iure.,67,2023-03-29 04:43:23
283,332,Kendaraan Pakai Kredit Jarang Murah Pribadi Km Jarak Oli,895000000,Possimus maxime distinctio sint aut.,76,2023-04-24 02:30:41
284,297,Oli Cat Eksterior Interior Mulus Pemakaian Kondisi,1100000000,Est ad natus voluptatem commodi debitis. Sint cumque rem dolor placeat.,119,2022-12-03 12:44:54
285,39,Baru Km Mesin Mulus Negotiable,139000000,Cum ab perspiciatis tenetur ut tenetur. Similique soluta ea aut blanditiis.,82,2022-11-19 16:19:22
286,218,Full Kilometer Cash Harga Terawat Dokumen Dp Warna,800000000,Ipsam sit inventore cumque asperiores beatae libero libero. Deserunt rerum repellat qui.,65,2023-01-16 15:08:25
287,221,Mulus Service Stnk Bukan rental Pakai Pajak Asli,645000000,Quod ducimus voluptatum repellendus rem optio.,179,2023-03-11 06:24:06
288,67,Service Interior Terjamin Nego Cat Tangan Cash Kredit,220000000,Incidunt aspernatur ipsum sed dolorem deleniti. Minus qui minus dolorem. Nostrum consectetur aliquid corporis quia magnam id corrupti.,147,2022-11-15 17:10:18
289,21,Dokumen Eksterior Tangan Nego Nopol Jarak Bukan rental Tahun Ban,463000000,Ad reiciendis quasi itaque. Itaque animi molestiae consequuntur molestiae minus non recusandae.,41,2023-01-13 23:15:32
290,192,Cicilan Cash Kredit Jual Negotiable,470000000,Nihil quasi mollitia soluta. Omnis numquam placeat repellat.,159,2023-03-30 09:12:51
291,300,Surat Kredit Asli Dp Kilometer Mulus Warna,375000000,Dolor cumque ratione incidunt tempore dicta fugit. Quae nemo necessitatibus alias perspiciatis occaecati a.,192,2023-04-15 02:02:58
292,222,Cat Baru Siap Langsung Km Jarang Ban,4650000000,Voluptate expedita hic libero. Tempora pariatur nisi quod. Dolore quia itaque id. Debitis soluta perferendis voluptates nostrum blanditiis occaecati.,36,2023-04-26 05:19:45
293,295,Warna Interior Ban Tangan Nopol,1500000000,Ab dolorem optio quis. Debitis aperiam at neque dolorem magnam eligendi. Nam dicta illum tempora rerum officiis eos modi.,60,2023-01-29 15:35:03
294,388,Eksterior Jarang Cicilan Terjamin Bekas Kredit Murah Mulus Oli Velg,450000000,Voluptatibus repudiandae tempore nulla voluptatem. Facere quis mollitia voluptates. Labore similique blanditiis vero soluta.,5,2022-10-16 10:14:29
295,216,Jarak Pemakaian Dokumen Berkualitas Pajak Tangan Ban Kilometer Negotiable Cicilan,127000000,Quidem illum neque ipsum sint. Rerum rem libero aspernatur.,135,2023-05-23 17:18:17
296,289,Kilometer Cash Oli Nego Jual Harga Dp Pemakaian Terawat,159000000,Laborum quos laboriosam earum. Ad totam aspernatur animi velit hic.,165,2023-05-14 21:41:55
297,3,Dokumen Asli Km Pakai Pemakaian Harga Berkualitas Original,220000000,Ipsam eaque aut nisi hic eligendi voluptatum. Dolore ab quae veritatis.,147,2023-02-03 09:00:39
298,354,Terjamin Asli Cash Interior Pajak,139000000,Veniam illum excepturi. Perspiciatis dolores illo.,82,2023-01-21 20:21:41
299,14,Jual Kondisi Ban Bukan rental Mulus,355000000,Blanditiis minus corrupti. Modi enim quia minus quasi veritatis.,147,2023-03-27 16:36:14
300,94,Pakai Pajak Terjamin Nego Full Mulus Ban Kilometer Eksterior,1500000000,Autem commodi vitae voluptatibus similique. Iusto et repudiandae officia esse. Ducimus a rerum nesciunt asperiores quisquam nam libero.,60,2022-10-22 02:53:11
301,102,Original Warna Murah Surat Kendaraan Cat Stnk Pakai,125000000,In quae esse et natus. Quae odio eaque quaerat dolor voluptas.,113,2023-01-12 17:05:02
302,208,Berkualitas Nopol Warna Ban Asli,850000000,Repellendus fuga eveniet quia explicabo optio quas tenetur. Dignissimos tempore repellat porro. Aliquam deserunt itaque unde harum distinctio mollitia.,119,2023-07-17 05:11:35
303,129,Eksterior Jarak Terawat Tangan Bukan rental Kondisi Jarang Surat Pajak Ban,545000000,Sed recusandae veritatis tempore officiis.,76,2022-12-16 09:46:11
304,293,Stnk Warna Tahun Pajak Berkualitas Dokumen Siap Pribadi Full,215000000,Laudantium facilis incidunt. Alias doloremque eum animi dignissimos.,56,2023-01-05 07:36:06
305,105,Mesin Kredit Full Asli Eksterior Jarak,260000000,Commodi odio quisquam rerum corrupti deleniti blanditiis dicta. Minus dolorem facilis ratione doloribus minima. Impedit omnis rerum doloremque laudantium odio.,200,2023-07-01 03:39:47
306,259,Stnk Cash Pemakaian Bukan rental Pakai Original Pajak,123000000,Sint pariatur quos vel iure assumenda similique. Necessitatibus quidem suscipit ullam dolor pariatur.,43,2022-12-17 18:43:21
307,293,Pajak Original Cash Jarang Mulus Berkualitas Pemakaian Pakai,135000000,Illum incidunt quis rem. Quae nulla ut expedita deleniti excepturi minima. Hic commodi laboriosam.,122,2023-01-01 23:22:59
308,385,Surat Full Negotiable Dp Terjamin Pajak Jual Interior Oli,123000000,Error totam ad repellendus consequatur nesciunt placeat provident. Explicabo eius cumque distinctio provident deserunt.,165,2023-03-02 20:01:59
309,311,Jarang Stnk Cash Cicilan Tahun Velg,1845000000,Minus ipsa optio illum aliquid reiciendis iure. Assumenda exercitationem ad consectetur enim beatae.,45,2023-03-19 16:50:22
310,285,Negotiable Siap Berkualitas Murah Jual Dp Ban Oli Full,325000000,Repellat tempora hic neque neque assumenda. Soluta eaque facilis ipsa autem. Deserunt eius quibusdam reprehenderit facere voluptatem.,34,2023-03-18 19:19:02
311,27,Negotiable Kondisi Terawat Full Jarang Kendaraan,1075000000,Odio voluptatum repudiandae ducimus maxime.,138,2022-11-28 02:22:07
312,334,Pakai Negotiable Kondisi Pajak Interior Siap Baru Mobil Km,110000000,Quidem ducimus provident vel. Incidunt facilis voluptatum ratione in.,11,2023-05-01 17:12:40
313,362,Kilometer Tangan Bekas Surat Jual Ban Jarang Pajak Berkualitas Original,1450000000,Deserunt unde aliquam inventore. Quos fugit nobis praesentium corrupti.,45,2023-08-04 20:59:10
314,104,Service Kredit Jarang Ban Nopol Cat Bukan rental Eksterior Pemakaian,276000000,Asperiores facere odio reiciendis quas tempora. Eaque voluptatem quisquam dignissimos magni soluta.,98,2022-09-19 03:24:34
315,97,Surat Full Kondisi Siap Harga Mobil Cash Stnk Warna,297000000,Itaque consequatur eaque dolor. Inventore dicta accusamus quam eaque.,97,2023-04-05 12:50:59
316,12,Velg Cash Murah Service Oli Pakai Pemakaian,230000000,Velit facere reprehenderit fugit minus minima. Iste fuga odio delectus facere recusandae minima. Quae saepe alias quasi facere alias in.,200,2022-12-08 00:50:28
317,347,Berkualitas Negotiable Dokumen Interior Cat,123000000,Temporibus rem sapiente quod laboriosam excepturi. Cumque porro ratione esse libero ad. Tenetur optio excepturi.,118,2023-03-15 05:34:52
318,151,Langsung Cat Bekas Negotiable Pajak Asli Harga Terawat,350000000,Explicabo amet natus fugit. Doloribus ut omnis nam optio.,200,2023-03-23 12:10:48
319,106,Mesin Bekas Jarak Baru Original Nopol Terjamin Jual Asli,159000000,A alias vero. Aut praesentium delectus quam explicabo laudantium iure. Eveniet earum velit dignissimos vel.,118,2023-02-27 00:27:25
320,387,Original Dp Cat Warna Langsung Pribadi Bukan rental,225000000,Fugit rerum eius tempora possimus sint vero. Sunt tempore molestiae aliquam eum.,80,2022-09-15 19:14:07
321,27,Pemakaian Cicilan Surat Harga Oli Berkualitas Kredit Terjamin Negotiable Dokumen,550000000,Eligendi officiis rem incidunt.,75,2023-04-23 10:27:52
322,106,Mulus Surat Dokumen Jarang Ban Velg Original Service,1650000000,Ad vitae doloremque. Explicabo quos fugit beatae.,138,2022-11-17 09:09:10
323,297,Cash Km Siap Pemakaian Mulus Nego Kendaraan,245000000,Cupiditate reiciendis rem illo. Est earum repellat provident vitae voluptas quam. Cupiditate eveniet aperiam impedit laboriosam qui ipsa. Quos sapiente ratione odit fugiat aliquam praesentium.,106,2023-07-26 10:53:33
324,305,Bekas Nego Asli Eksterior Original Bukan rental Surat Warna Kondisi Negotiable,355000000,Numquam asperiores eos nesciunt eius. Delectus quia ex explicabo temporibus nostrum blanditiis tenetur. Aspernatur eius molestias dicta nihil amet voluptate.,190,2023-03-12 11:00:39
325,111,Mobil Pajak Tangan Stnk Berkualitas Interior Oli,180000000,Quibusdam ipsa error deserunt numquam.,66,2022-12-12 02:12:27
326,397,Km Cat Berkualitas Dokumen Kondisi Oli Negotiable,215000000,Beatae explicabo quibusdam. Magnam veritatis laborum quia alias nisi cupiditate rerum.,98,2023-02-21 02:36:50
327,132,Negotiable Baru Tahun Warna Tangan Ban,276000000,Hic culpa blanditiis ipsa doloribus eius. Necessitatibus eaque eligendi necessitatibus rem. Maxime mollitia perferendis enim mollitia.,102,2022-12-12 17:45:19
328,30,Original Km Full Berkualitas Terawat Terjamin Siap,850000000,Reiciendis commodi laboriosam assumenda ea ullam. Minima totam porro nulla eaque.,24,2023-06-25 15:55:17
329,325,Ban Mobil Bekas Kredit Baru,860000000,Accusamus ea dolorem occaecati officia voluptatum error excepturi.,68,2023-04-27 11:26:25
330,305,Bekas Tangan Pakai Dokumen Terjamin Oli Mesin Tahun Surat Warna,1500000000,Ex illum maiores totam. Dolorem blanditiis eum.,40,2023-03-27 20:14:47
331,186,Kondisi Warna Pajak Velg Service Interior Baru Mesin,120000000,Similique dolorem aspernatur dolorum sit voluptas. Perspiciatis adipisci in possimus fugit.,161,2023-01-08 17:37:40
332,347,Bekas Kendaraan Langsung Surat Pakai Cicilan Siap Jarang Nopol Interior,125000000,Consequatur repellendus exercitationem accusantium nemo necessitatibus. Amet maxime ipsam tempore excepturi blanditiis. Repellat minus nemo itaque vitae illum.,183,2023-07-20 19:40:11
333,284,Kredit Pakai Cat Terjamin Original Nopol Asli Kilometer,1745000000,Eaque reiciendis modi quisquam deserunt neque expedita. Ipsa excepturi cumque repellendus hic. Deserunt iusto tempora accusamus commodi.,128,2023-05-21 05:13:15
334,160,Nego Terjamin Jarak Kendaraan Cash Pakai,325000000,Aliquam blanditiis enim consequuntur.,136,2022-09-14 08:58:33
335,44,Pemakaian Kredit Bukan rental Berkualitas Nego Tahun,1700000000,Ea totam beatae beatae repudiandae reiciendis.,40,2022-12-12 15:46:51
336,40,Negotiable Dokumen Pajak Service Bukan rental Nopol Kilometer Pakai,245000000,Ullam sunt accusantium recusandae esse molestiae expedita. Quaerat eaque nemo blanditiis.,144,2023-01-06 21:39:53
337,339,Tangan Kredit Pemakaian Harga Tahun Mobil Dp Negotiable,485000000,Laborum numquam reprehenderit dolore. Veniam nostrum nemo fuga vero. Dolor similique atque dolorem consectetur ratione.,75,2023-05-10 17:55:52
338,334,Baru Tahun Mobil Tangan Jarak,230000000,Modi quidem culpa atque. Accusantium perferendis suscipit magni tempora.,102,2022-12-26 04:34:35
339,57,Surat Cicilan Baru Bekas Service Tangan Original,975000000,Nesciunt delectus autem id necessitatibus. Vitae magni iusto mollitia. Dolor nam ipsam corrupti.,6,2023-06-29 05:43:20
340,165,Stnk Surat Bukan rental Terjamin Langsung Bekas Cat Km,228000000,Vitae sapiente voluptatum illo laboriosam. Odio deleniti aperiam exercitationem optio animi unde.,196,2023-06-16 14:31:25
341,100,Kondisi Km Surat Jarak Bekas Negotiable Harga Pajak Oli Eksterior,285000000,Quam voluptatibus blanditiis quidem voluptate facilis assumenda. Veritatis modi laborum quisquam.,50,2023-05-21 08:27:37
342,364,Pakai Terjamin Cash Surat Mobil Murah Pajak Mesin Stnk Full,155000000,Impedit consequuntur labore expedita itaque placeat voluptatibus. Enim molestiae maiores necessitatibus at. Consequatur fuga accusamus pariatur. Animi unde numquam et atque quae soluta.,113,2023-02-20 14:26:38
343,27,Interior Dokumen Jual Warna Tahun Oli Surat Original Berkualitas,300000000,Consequuntur necessitatibus quasi tempora. Aperiam repudiandae explicabo officia expedita temporibus necessitatibus. Ut pariatur nostrum provident corporis quo nemo.,181,2022-09-03 06:14:10
344,135,Service Tahun Pemakaian Cicilan Nopol Interior Dp Pakai Harga,440000000,Enim est ut illo repudiandae placeat. Voluptatum vel eveniet similique nostrum rerum soluta. Perspiciatis culpa aperiam culpa hic odit quis.,136,2023-03-06 02:24:57
345,210,Warna Tangan Full Pajak Eksterior Nego Jarang,200000000,Quibusdam eos beatae odio libero. Dolorum eveniet voluptates sapiente rerum provident esse enim.,54,2023-04-27 10:01:46
346,377,Kondisi Jual Velg Dokumen Surat Bukan rental Oli,150000000,Incidunt laborum blanditiis facilis quas aliquam iusto. Sit maxime sed ab.,63,2023-04-23 06:10:51
347,268,Langsung Pribadi Cat Terjamin Dp Surat Mulus,123000000,Rerum explicabo culpa debitis molestias ea vero quas. Vitae error nisi quod minima magni nulla.,8,2023-06-17 05:58:37
348,30,Asli Kendaraan Nego Full Kondisi Bekas Oli Jarang Berkualitas,2750000000,Quae facere eveniet culpa non illum tenetur. Eveniet repellendus magni alias voluptates facere fugit eos.,147,2023-06-01 04:41:15
349,272,Service Kendaraan Interior Surat Original Pajak Tangan Kredit,245000000,Distinctio ea facere eum laborum accusamus. Ipsa dignissimos veniam ipsam recusandae laborum impedit.,30,2023-06-10 05:04:11
350,350,Langsung Baru Tahun Bekas Warna Velg Asli Cash Siap Dokumen,235000000,Molestiae repellendus saepe. Dolor nesciunt sunt vero.,89,2023-01-09 02:43:06
351,68,Stnk Murah Km Nopol Surat Jarang Dp,4650000000,Odit doloremque officia. Iusto ratione laudantium assumenda. Magni minus iusto molestiae.,150,2022-11-18 18:16:38
352,259,Terjamin Mesin Baru Pajak Original,445000000,Sequi tenetur quam quam nemo nisi facilis. Odio eum perspiciatis facilis ut natus. Molestias ea labore error tenetur officia.,97,2023-02-24 04:49:57
353,135,Cicilan Tahun Bekas Eksterior Langsung Service,180000000,Nesciunt reprehenderit ipsum natus amet. Amet consectetur iste accusantium.,31,2022-12-01 06:08:18
354,396,Murah Interior Cash Full Siap Tahun Velg Kondisi,254000000,Nesciunt modi rem. Delectus mollitia perferendis at. Modi laborum soluta est.,109,2023-02-05 08:32:38
355,311,Velg Full Tangan Pribadi Mesin Dp Cat Nopol Terawat,276000000,Ratione ut ipsa harum ipsum. Corporis libero qui quo blanditiis repudiandae tempora. Minus fugit aperiam nesciunt error nesciunt.,98,2022-12-18 03:20:31
356,327,Eksterior Service Bukan rental Kilometer Mulus,910000000,Voluptates consequuntur eius excepturi asperiores ratione in. Consequuntur impedit quod iure. Nisi facilis temporibus enim natus magni.,64,2022-10-13 14:39:06
357,346,Tangan Terjamin Pribadi Terawat Original Km Langsung Nego,130000000,Repellendus ratione magni illum sapiente omnis deserunt aspernatur. Velit eius odit sed nostrum in excepturi vitae.,17,2022-08-20 20:01:12
358,355,Bukan rental Tangan Pajak Cicilan Original,679000000,Eaque porro beatae adipisci odio molestias. Molestiae totam delectus placeat odio. Maxime eos placeat est.,133,2023-05-18 05:34:12
359,8,Jual Kredit Dp Surat Nego Velg Warna,975000000,Rem itaque suscipit laudantium ad minima eos. Eum magnam voluptatibus asperiores assumenda architecto.,93,2023-04-14 09:33:19
360,299,Mobil Jarak Nego Oli Dp Km Mesin Full Bekas,245000000,Sequi ipsam quae exercitationem et delectus eveniet aperiam. Deleniti impedit beatae ducimus. Qui magni quibusdam veritatis eaque suscipit aperiam.,21,2022-10-02 08:57:21
361,329,Murah Cicilan Mobil Interior Eksterior Pemakaian Nopol Mesin,210000000,Repellendus recusandae voluptatibus eligendi. Illum corporis aliquam labore. Aut animi eos eveniet ab illum aspernatur. Molestiae illo ipsa blanditiis officia ad autem.,106,2023-02-06 12:45:33
362,46,Kilometer Velg Jarak Negotiable Km Siap Dokumen Kredit,215000000,Repellat blanditiis numquam iusto ducimus sequi similique. Nihil veritatis harum nam assumenda hic id. Eaque incidunt fuga a eligendi.,35,2023-05-12 23:06:32
363,88,Cat Bukan rental Original Nego Tangan Baru Kilometer,245000000,Possimus amet esse suscipit accusantium sit necessitatibus mollitia. Rerum dolor cum sapiente deserunt occaecati tenetur. Excepturi est asperiores quod ipsa similique nulla. Vel odio id culpa deserunt nobis.,144,2022-11-21 02:35:46
364,12,Cat Surat Harga Velg Service Stnk Siap,320000000,Molestiae molestiae unde et. Sunt adipisci officiis consequatur dolor sit. Occaecati totam quasi corrupti earum.,192,2022-11-14 19:27:03
365,185,Km Pakai Mulus Original Nego,910000000,Perspiciatis velit corrupti hic sint. Consequatur saepe praesentium explicabo maxime eligendi natus. Odit temporibus harum minus.,120,2022-11-25 11:08:34
366,8,Velg Cat Pakai Siap Original Pemakaian Terjamin,120000000,Recusandae voluptate repudiandae mollitia error aspernatur distinctio. Aperiam minima tempora numquam nam tempore. Sunt repellat praesentium provident adipisci.,88,2023-03-07 04:35:59
367,270,Velg Kendaraan Cat Terawat Harga,260000000,Doloribus facere atque maxime eveniet iusto. Ipsum sunt dignissimos ipsum.,35,2023-03-17 00:09:36
368,162,Tahun Velg Warna Bekas Pemakaian Ban,1950000000,Omnis optio qui autem illo. Laborum quibusdam placeat alias illo neque. Modi nostrum modi nostrum.,107,2023-01-04 05:05:45
369,368,Mulus Mesin Pakai Pemakaian Kilometer Murah Langsung,1350000000,Perspiciatis numquam iste. Laborum porro ex sed doloribus quos nam. Occaecati nemo rem vero maiores.,95,2022-11-07 04:30:29
370,68,Mulus Full Mesin Langsung Negotiable Harga Tahun,100000000,Officiis autem aliquam voluptates itaque adipisci. Natus quisquam quidem. Debitis est tempora vero reprehenderit suscipit incidunt.,188,2023-01-16 16:35:04
371,320,Service Berkualitas Full Asli Surat Kredit,650000000,Amet alias tempore ratione occaecati inventore facilis. Ad excepturi corporis.,140,2023-03-22 14:22:21
372,22,Pajak Interior Velg Stnk Pribadi Terjamin Nego,146000000,Hic tempore libero nobis veritatis numquam.,168,2023-01-03 07:14:35
373,399,Harga Terjamin Cicilan Dp Warna Baru,230000000,Aut praesentium labore qui ipsum. Labore natus nulla tempora sed.,31,2023-06-27 20:34:43
374,173,Siap Kredit Negotiable Cat Bukan rental Stnk Dokumen Pribadi,975000000,Consequuntur ducimus quasi repellat dolorem ratione incidunt. Quis optio voluptatem architecto temporibus. Nulla inventore perferendis sunt ea. Repellendus molestias molestiae in deleniti ab molestiae.,138,2022-12-01 01:49:25
375,107,Original Pakai Kondisi Cicilan Asli Berkualitas Oli Kredit Cash Jarak,1745000000,Voluptatibus quo optio quaerat sit vitae labore. Officia reprehenderit dolorem in nulla. Molestiae repudiandae quam rerum amet excepturi.,4,2023-03-25 21:52:45
376,394,Warna Ban Negotiable Full Oli Jual Mobil Asli,1845000000,Dolor provident velit doloremque.,4,2023-01-02 21:53:46
377,239,Tangan Ban Kilometer Stnk Kondisi Murah Pemakaian Jarak Interior Baru,775000000,Vel earum cupiditate distinctio. Voluptate officia sit. Possimus culpa impedit quaerat.,180,2023-03-06 06:19:40
378,97,Terjamin Baru Full Murah Bekas Kilometer Kondisi Jarang Eksterior,215000000,Unde adipisci asperiores eum optio sed saepe. Tenetur suscipit fugit magni. Itaque ducimus quia.,56,2023-04-04 21:29:02
379,120,Nopol Tahun Terawat Full Mobil Harga Nego Kendaraan Asli Jarak,850000000,Quam itaque dolor reprehenderit. Optio natus exercitationem eum qui. Iusto porro ratione amet dicta ad voluptatum.,69,2022-10-17 05:54:02
380,357,Murah Harga Service Kondisi Cicilan Stnk Jarang Pajak Tangan,245000000,Magnam veritatis eligendi. Quasi dolores eos harum ratione eaque. Eveniet tenetur sint blanditiis possimus repellendus.,153,2023-06-01 08:31:04
381,266,Pajak Tahun Mesin Negotiable Pribadi Nego Murah Pemakaian Jarak Ban,5800000000,Illo optio numquam magni aut aperiam dicta molestiae. A cupiditate veritatis nulla culpa mollitia. Aspernatur officia neque voluptate.,177,2022-11-18 03:37:12
382,247,Baru Jual Kilometer Oli Mulus Mesin Cat Dp Surat Berkualitas,1295000000,Optio saepe expedita laudantium. Voluptate doloremque ducimus enim eum quae repellat.,7,2022-09-22 01:48:22
383,20,Siap Nopol Oli Tangan Warna Baru Terawat Pajak Cash Jarak,147500000,Recusandae repellendus nemo voluptas. Officiis consectetur hic minus.,116,2023-02-20 13:05:42
384,110,Pajak Bukan rental Siap Nopol Tangan Km Harga Mulus Mesin,4650000000,Maiores repudiandae adipisci ea provident. Ex deleniti odio dolor.,177,2023-02-24 19:54:48
385,80,Cicilan Kredit Stnk Jarak Ban Kendaraan Baru,899000000,Laborum tempore ipsa quis fugiat quibusdam reprehenderit. Ad maxime inventore exercitationem nostrum culpa. Animi provident natus quae accusamus ducimus illum.,67,2023-02-04 08:45:11
386,133,Pajak Bekas Pribadi Warna Dp Mulus Langsung,850000000,Ducimus aperiam aliquid vero eaque. Deleniti omnis eius voluptatibus quod est ullam. Voluptate deleniti voluptatum cumque odit quis maiores aut.,29,2022-11-11 02:54:35
387,398,Tangan Nopol Mulus Pakai Mesin,1980000000,Sunt sequi alias aut cupiditate in. Hic a voluptates at.,52,2023-01-29 15:24:23
388,399,Kondisi Velg Cat Surat Cicilan,135000000,Ex facilis commodi quod ad.,71,2023-05-01 20:20:34
389,159,Full Siap Bukan rental Eksterior Nopol Warna Mulus,899000000,Commodi amet voluptatum eos doloremque soluta. Ad provident praesentium quos enim deserunt.,52,2022-12-31 07:06:05
390,210,Jual Warna Tangan Langsung Cat Kredit Cash,245000000,Voluptates tempore nam. Minus debitis magnam excepturi.,146,2023-03-03 23:41:34
391,336,Full Eksterior Tahun Jarak Terjamin Bukan rental Negotiable,325000000,Omnis sequi quae commodi iure eligendi eveniet optio. Illum asperiores perferendis tenetur.,189,2022-10-16 06:39:27
392,345,Mesin Berkualitas Harga Pajak Pemakaian Velg Mobil Jarak Jual Cat,500000000,Ratione earum eos tempore aliquam neque unde.,123,2023-06-22 15:53:05
393,329,Terawat Jarak Bekas Cat Baru Eksterior Kilometer Tahun Dokumen Mesin,899000000,Quis necessitatibus consequatur magni. Numquam adipisci sit atque.,67,2023-04-11 09:06:48
394,291,Harga Pemakaian Langsung Stnk Negotiable Jarang Kendaraan Siap Terjamin Cicilan,285000000,Esse omnis ipsum velit maxime quas natus. Doloribus quasi odit dolorum repellendus laudantium libero. Soluta culpa earum architecto. Distinctio id quo earum.,41,2023-05-10 16:21:43
395,279,Asli Pajak Nego Dp Langsung Jarang Tangan Kondisi,95000,Possimus culpa facilis inventore est. Nesciunt exercitationem saepe.,18,2022-11-14 15:06:03
396,172,Km Bukan rental Mesin Cat Cicilan Pakai Terawat,225000000,Officia harum expedita nisi quod. Quibusdam ullam voluptas inventore nihil consequuntur maiores. Molestias delectus ipsa eligendi doloremque accusantium.,112,2023-01-12 15:08:24
397,242,Km Oli Service Kredit Jual Tahun Jarak,398000000,Libero error consequuntur laborum velit a. Ea corporis ea delectus. Sed asperiores deserunt.,156,2023-05-21 07:07:29
398,81,Surat Jarak Siap Jual Interior Asli,230000000,Iusto vitae maxime explicabo earum sapiente. Veniam eum animi hic explicabo non. Sed porro delectus corrupti esse voluptatum expedita.,20,2022-10-16 15:01:21
