ad_id,user_id,title,price,description,car_id,date_posted
399,71,Cat Pajak Ban Tangan Nopol,159000000,Possimus perspiciatis beatae harum dignissimos quas velit. Ad cupiditate voluptatem veritatis cupiditate sunt delectus perspiciatis.,163,2022-10-03 04:47:55
400,326,Mesin Negotiable Pemakaian Mobil Jual Velg,850000000,Vel facilis quam voluptatem dolores quae dolorum. Sunt aperiam mollitia officiis corrupti nam.,151,2023-03-30 13:22:57
401,144,Terjamin Original Surat Baru Warna,228000000,Est sit commodi. Error fugit occaecati voluptatem. Architecto repellendus itaque quod. Dolorum corporis excepturi harum rem.,196,2022-12-18 22:35:07
402,312,Stnk Jarang Velg Original Km,350000000,Enim omnis sint laborum incidunt quisquam. Iusto consequuntur possimus deleniti culpa ab. Voluptatibus ducimus mollitia esse distinctio eum quas.,200,2023-08-11 20:11:54
403,129,Mesin Stnk Nego Km Terawat Jarak Nopol,375000000,Quam modi eum unde deserunt non. Voluptates laudantium quos odit quis aperiam. Alias nisi ea deleniti sit.,192,2023-08-03 19:03:24
404,95,Eksterior Terjamin Original Harga Interior Dokumen Asli Bekas Siap,500000000,Sint ea ex laudantium. Doloremque quos odit magnam consequatur reprehenderit id.,90,2023-05-07 10:11:45
405,280,Berkualitas Pakai Terjamin Kredit Mesin Pemakaian Tangan Negotiable Interior,355000000,Unde omnis eius dolore ratione. Cupiditate modi vero dolorum ipsam.,19,2023-01-17 18:53:10
406,58,Siap Negotiable Mulus Interior Tangan Stnk Berkualitas Kondisi,1700000000,Ad recusandae mollitia quo officia. Quod delectus ipsa maiores cupiditate ipsam.,130,2022-12-17 13:19:21
407,314,Nopol Dokumen Pakai Velg Pribadi Mesin Cicilan,285000000,Vero asperiores voluptatum dolore at.,41,2023-03-30 14:40:58
408,139,Langsung Jarang Jarak Asli Pemakaian Bukan rental Kendaraan Mobil,110000000,Tempora aspernatur perspiciatis enim. Consequatur saepe amet aspernatur culpa ducimus quibusdam corporis.,178,2023-03-12 04:24:59
409,91,Jual Harga Surat Nego Mesin,4650000000,Eaque vitae voluptatum ipsa doloremque voluptas itaque. Neque fugit tenetur sint tenetur nemo atque. Assumenda placeat earum est unde quisquam quo.,27,2023-02-26 12:39:33
410,394,Siap Kondisi Negotiable Pribadi Interior Cat Warna,220000000,Nostrum esse iste voluptates placeat.,174,2023-03-06 09:49:43
411,41,Bekas Baru Pajak Harga Mesin Jarak Original Oli Bukan rental,212500000,Est saepe sint occaecati beatae.,168,2023-04-24 05:50:09
412,35,Full Pajak Ban Asli Velg Service Kilometer Interior Terjamin,1500000000,Aut eos voluptas ratione. Ipsum natus dolorum alias quasi perspiciatis vitae. Quas voluptatem aliquam ab.,125,2023-02-05 05:41:03
413,13,Mulus Pribadi Tangan Full Service,450000000,Praesentium voluptatibus nesciunt consequuntur consequatur aut minus. Adipisci blanditiis autem beatae dignissimos illo accusamus.,2,2022-12-08 16:00:41
414,250,Mulus Velg Nego Cat Jarak Warna Asli Dp,679000000,Possimus cupiditate consequatur. Reprehenderit neque vel quis. Placeat assumenda accusantium deserunt.,160,2022-12-18 07:41:19
415,175,Terawat Pakai Negotiable Service Bekas Murah Asli Interior,285000000,Iste blanditiis sapiente nisi in repudiandae temporibus. Enim possimus id vel.,50,2023-01-07 23:09:35
416,158,Oli Ban Nopol Terjamin Mesin Velg Pakai Asli Stnk Bekas,110000000,Perferendis veritatis provident sed animi consequuntur veniam natus. Itaque voluptates eligendi consectetur est inventore qui. Esse tempore quas quo.,178,2022-11-30 19:36:00
417,175,Kendaraan Ban Kredit Surat Terawat Harga Tahun,1500000000,Perspiciatis distinctio pariatur neque. Voluptatem at dignissimos.,154,2023-05-04 18:48:59
418,210,Surat Berkualitas Terjamin Murah Jual Mulus,127000000,Vero ea quae consequuntur amet velit. Omnis maxime unde velit.,116,2023-02-25 12:54:39
419,279,Kredit Kilometer Service Cash Bekas Jual Asli Tahun Dp Terawat,860000000,Quod voluptatum voluptatum harum in. Ut eveniet hic totam.,52,2023-07-21 17:42:55
420,184,Dokumen Cash Warna Tahun Tangan Nopol Jual Kendaraan,325000000,Fuga sint a officia corporis assumenda. Explicabo cupiditate neque esse.,189,2023-04-05 22:54:04
421,6,Original Pakai Siap Eksterior Mobil Velg Stnk Kilometer,230000000,Sed ab est deserunt optio delectus. Magnam tempore impedit architecto amet.,102,2023-02-14 20:15:50
422,195,Bekas Terjamin Mesin Baru Pemakaian,975000000,Minima suscipit ipsum rem porro maiores sed. Neque placeat perferendis enim voluptatum quae. Doloribus et repudiandae in in animi deserunt.,138,2023-03-31 00:53:30
423,153,Terawat Tahun Baru Pajak Harga Cash Bukan rental Service,850000000,Amet qui impedit. Deleniti illo ipsum occaecati eum cupiditate culpa. Temporibus asperiores hic error eos alias.,2,2023-01-13 05:34:22
424,383,Terjamin Tahun Kondisi Bukan rental Harga Kredit Tangan,230000000,Expedita maxime magni saepe velit. Quos fugiat sit natus commodi maxime porro. Aperiam natus vero quos quidem nisi dolores.,102,2022-12-07 07:58:14
425,119,Interior Jarang Nego Km Warna Stnk Kondisi Terawat Siap Ban,517000000,Doloremque eos eius sapiente aliquid quod. Similique debitis asperiores deserunt.,166,2023-06-29 22:30:19
426,68,Kredit Bukan rental Kilometer Surat Bekas Baru,300000000,Veniam dolores ipsum occaecati optio exercitationem quidem. Odit totam eius nobis ratione. Facilis distinctio neque repellendus. Eos culpa deserunt similique sunt provident quis.,181,2023-05-23 00:15:24
427,124,Full Murah Siap Pribadi Stnk,245000000,Dicta dolorum esse dolor commodi id. Hic vel nostrum corrupti aut. Veniam praesentium rem quia deleniti facere. Repudiandae cum quisquam ad suscipit possimus.,12,2023-05-19 19:49:11
428,10,Nopol Cat Interior Jual Cash Dp Dokumen,679000000,Repellendus magnam accusamus nisi. Praesentium blanditiis laboriosam excepturi magnam. Quam perferendis vel cupiditate iste ratione unde modi.,160,2022-12-31 01:27:05
429,370,Kendaraan Kilometer Pribadi Terjamin Tangan Bekas,775000000,Impedit maiores optio. Voluptatum aut libero. Quae accusamus culpa autem.,160,2023-05-02 22:37:53
430,350,Kilometer Full Kendaraan Langsung Kondisi Mulus Velg,210000000,Totam labore perferendis voluptatibus maiores. Excepturi est dolor quos natus aspernatur.,106,2023-04-16 08:13:36
431,305,Tangan Eksterior Pribadi Full Bukan rental Berkualitas Cash Original Pemakaian,398000000,Illo et inventore ex. Labore unde explicabo doloremque. Alias deserunt cumque nam sint.,148,2023-01-20 12:40:37
432,62,Terawat Kendaraan Pribadi Dp Warna Bekas Tangan,1450000000,Necessitatibus perspiciatis consectetur similique. Eveniet dignissimos ullam sed reprehenderit voluptate. Nobis dolorem quibusdam repellat harum.,32,2022-10-10 14:21:00
433,258,Pemakaian Dokumen Berkualitas Mulus Stnk Oli Kilometer Kredit Nego Ban,650000000,Autem sunt fuga dolores. Fugiat id ab doloribus praesentium enim excepturi. Rem delectus aspernatur esse aut beatae cupiditate. Recusandae sapiente minus mollitia facilis ab possimus quis.,140,2023-06-11 07:07:13
434,46,Berkualitas Service Bukan rental Terjamin Mulus,212500000,Quae repellat perspiciatis sit dolore rerum. Amet architecto alias eaque. At praesentium repudiandae illum iusto dicta quidem.,168,2023-03-11 23:24:34
435,174,Negotiable Cat Eksterior Siap Pribadi,220000000,Voluptate possimus fugit corporis modi quia. Tenetur necessitatibus tempora odit quas.,147,2023-05-10 00:24:43
436,77,Bukan rental Surat Kondisi Terjamin Interior Harga Km,4000000000,Accusamus exercitationem labore similique. Occaecati rerum deleniti dolor ipsum consequatur quaerat. Molestias cum ipsam quos repellendus.,150,2023-04-22 02:55:48
437,187,Km Kondisi Stnk Full Baru,1700000000,Voluptatibus ea at. Dicta officiis dolore neque natus iure dolores.,154,2023-06-05 00:10:52
438,90,Dokumen Baru Terawat Dp Berkualitas Oli Velg Terjamin Cicilan,120000000,Quas ducimus in atque quod blanditiis. Neque illum esse similique eum sequi tempora. Facere delectus consectetur quisquam facere.,126,2023-01-23 07:19:08
439,65,Stnk Surat Full Pribadi Kilometer Harga Berkualitas,899000000,Laudantium consectetur sapiente vero. Voluptatem numquam incidunt aspernatur. Consequuntur necessitatibus nisi accusantium alias eius dolores. Quasi cum suscipit explicabo incidunt.,67,2023-06-13 16:26:43
440,368,Terjamin Service Km Oli Kondisi Cicilan Langsung,1500000000,Magni quisquam earum. Nulla soluta impedit ab nostrum eligendi in.,130,2023-02-02 09:31:23
441,135,Terjamin Kendaraan Original Interior Asli Surat Service Pajak,155000000,Autem corporis mollitia omnis officia quam molestias. Ullam numquam aspernatur deserunt quisquam eaque. Quas ipsum recusandae velit odit.,158,2023-01-14 07:06:32
442,126,Pribadi Tahun Langsung Eksterior Nopol Original Berkualitas Nego,146000000,Nihil aut voluptatum laborum illum numquam beatae. Doloribus tempora ipsam impedit. Deserunt enim quam recusandae eius dolorum.,46,2023-04-21 01:43:24
443,313,Pemakaian Eksterior Tahun Warna Jual Terawat,181000000,Sed modi possimus accusamus. Reiciendis sunt minus magnam labore numquam ullam.,143,2023-02-26 01:15:41
444,228,Full Kilometer Jarang Oli Tahun Jarak Nopol Negotiable Service Surat,110000000,Sapiente sequi maxime sed excepturi quod. Atque aut tempora quis. Quidem accusamus in quibusdam.,35,2023-05-06 06:28:04
445,238,Kondisi Full Bekas Harga Cash Service Mesin Eksterior Km Stnk,365000000,Similique deserunt pariatur nulla mollitia quam odit. Eius vitae quam voluptatem. Odit tenetur vel nesciunt tenetur.,159,2022-11-18 16:36:45
446,286,Bekas Siap Harga Dokumen Terjamin Tahun,440000000,Distinctio ad ipsum molestias. Quas nostrum error repellat asperiores laudantium nobis.,21,2022-11-07 08:03:43
447,312,Stnk Nopol Terawat Cat Langsung Pakai Eksterior Ban Tangan Kendaraan,775000000,Mollitia possimus inventore. Voluptate odit ex alias.,175,2023-01-10 11:06:36
448,383,Dp Service Kondisi Kredit Cash,1745000000,Odit nobis unde. Sed veniam repellendus animi nobis quos.,32,2023-05-11 14:15:44
449,210,Cash Dp Berkualitas Mulus Asli Dokumen Ban Warna Negotiable Velg,228000000,Debitis dolorem fugit assumenda omnis. Corrupti accusamus perferendis rerum voluptas consequuntur pariatur veritatis.,137,2023-07-03 18:44:32
450,137,Oli Terawat Ban Cicilan Bukan rental,510000000,Quis ullam sit delectus.,124,2023-01-15 15:55:49
451,165,Ban Asli Pajak Nego Kilometer,260000000,Necessitatibus non mollitia. Voluptatem esse veniam nam pariatur. Libero sapiente suscipit voluptate.,200,2022-10-21 12:26:20
452,19,Oli Kondisi Full Tahun Baru Warna Asli,1980000000,Accusantium quod possimus nulla facere animi. Repellendus debitis culpa autem eius iure consequuntur. Officiis ad eaque ut a aliquid repellat.,68,2023-04-08 08:52:08
453,330,Mesin Pribadi Pemakaian Tahun Kondisi Terjamin Warna Cat,365000000,Quam ut aspernatur doloremque dignissimos illum voluptatibus. Quod vel reprehenderit architecto incidunt iusto. Odio ad corporis neque.,84,2023-03-20 20:10:25
454,69,Mulus Jarang Pakai Jual Kredit Dokumen Terjamin Kendaraan,1980000000,Corrupti neque culpa aliquid suscipit explicabo. Ipsa eius quibusdam dolor sed dignissimos. Consectetur eligendi odit fugiat.,52,2023-01-04 08:43:03
455,175,Warna Nopol Kendaraan Service Tangan Cash,276000000,Nobis iste atque officiis vero magni molestias. Possimus voluptate fugiat aperiam quis illum dolore. Sit dolor nesciunt temporibus. Officia quisquam rerum illo.,98,2023-04-05 14:09:19
456,90,Cicilan Pakai Asli Service Jarang Berkualitas Dp,590000000,Incidunt eos eum earum.,91,2022-10-20 16:26:21
457,10,Cash Pemakaian Warna Tangan Full Harga Bekas,125000000,Temporibus ex ipsum debitis facere. Veritatis voluptates sapiente unde. Dignissimos reiciendis occaecati accusamus maxime illo.,195,2023-01-26 07:22:33
458,298,Nopol Pakai Kilometer Surat Pribadi Kendaraan Langsung,450000000,Illum consequatur enim earum. Impedit corporis ad porro magnam tempore aliquid.,5,2023-06-17 04:49:24
459,323,Tangan Cicilan Terawat Warna Pakai Interior Negotiable Original Terjamin Kredit,210000000,Error dicta adipisci quas quia iure ex. Sequi cum neque quibusdam quidem.,106,2023-02-17 09:44:05
460,92,Ban Eksterior Nopol Kondisi Murah Pajak Jual Km,200000000,Magnam dolorem similique voluptatum eveniet. Fugiat cumque corrupti possimus cupiditate in reprehenderit qui. Fuga quis repellat rerum architecto dolorem.,112,2022-12-20 10:33:29
461,112,Nopol Murah Mobil Tahun Jarang Jarak,285000000,Nihil necessitatibus ab fugit.,62,2022-12-06 00:06:40
462,354,Baru Mulus Murah Pemakaian Siap,517000000,Quia similique aperiam suscipit vitae voluptatem. Inventore vel sapiente at omnis voluptas eveniet. Cumque omnis incidunt iste reprehenderit. Autem ducimus quia voluptatem ipsa eum.,70,2022-12-19 17:48:51
463,27,Velg Ban Stnk Cash Dp Service Harga Tahun Full,159000000,Aspernatur nisi quia exercitationem culpa porro nam. Architecto vitae pariatur alias aliquam sunt. Tenetur eveniet reiciendis fugit.,157,2023-05-06 01:39:11
464,384,Full Kendaraan Terawat Langsung Tangan,1980000000,Asperiores quo perferendis nemo. Debitis aut occaecati excepturi impedit neque recusandae officiis. Minus voluptas dolore dolores vitae ipsum cum.,164,2023-06-15 10:21:11
465,315,Warna Kendaraan Pakai Siap Murah Terawat Km Berkualitas Kredit,590000000,Fugit delectus beatae odit. Ad facilis fugiat eaque dicta repellat. Fuga at natus.,96,2023-04-18 23:09:28
466,250,Eksterior Stnk Asli Kredit Pakai Service,123000000,Impedit nostrum tempora quam ut quisquam natus. Saepe expedita a consequatur laboriosam sit beatae. Voluptas optio ex optio.,15,2023-01-18 11:18:02
467,226,Berkualitas Oli Original Interior Asli Harga Dp,276000000,Ex corporis hic eligendi. Consectetur asperiores fugit.,98,2023-01-22 23:19:09
468,133,Jarang Kredit Dp Full Terjamin Bekas,1650000000,Inventore quod pariatur eligendi aut modi. Vero necessitatibus eius soluta officia sequi deleniti aperiam. Aliquid quisquam ipsam cupiditate. Deserunt ea mollitia exercitationem delectus neque aperiam beatae.,186,2023-01-10 04:31:26
469,127,Stnk Kredit Km Siap Harga Kondisi Langsung Pajak Bukan rental Surat,127000000,Labore eaque dolor veniam. Tenetur odio porro. Voluptate voluptatum praesentium recusandae.,11,2023-05-05 09:25:22
470,232,Siap Nego Mulus Eksterior Terawat,850000000,Ipsam quae modi accusantium tempora. Illo eum animi corporis aut est corrupti.,29,2022-12-21 06:29:05
471,358,Tangan Kondisi Pemakaian Jual Jarang,1425000000,Ratione voluptatibus sunt ipsam ipsam dignissimos at. Exercitationem beatae odio.,172,2023-05-28 12:20:56
472,364,Asli Jarak Harga Murah Pribadi Jual Ban,130000000,Laudantium error voluptate tenetur. Illo quos fugiat mollitia consequuntur.,111,2023-01-24 18:43:12
473,315,Kondisi Kilometer Langsung Warna Bukan rental Jarak Cicilan,159000000,Aspernatur aliquam occaecati iure temporibus. Doloremque accusantium sint.,184,2023-04-07 14:49:04
474,361,Pemakaian Mesin Jual Cicilan Km Tahun,125000000,Sunt eum perspiciatis repudiandae beatae at magni. Cupiditate repellat voluptates suscipit quidem quis suscipit. Quasi nemo impedit harum voluptatum.,122,2023-02-12 21:22:17
475,224,Negotiable Terawat Bekas Mobil Km,398000000,Laborum nihil culpa nam et. Corporis pariatur ipsa vero.,169,2022-10-14 05:08:23
476,80,Kredit Cash Mulus Kendaraan Full Velg Dokumen,230000000,Quae quos ratione sapiente. Neque explicabo vel ab ad explicabo quia.,115,2023-04-18 12:47:20
477,121,Full Km Baru Bukan rental Dp Jual Kondisi,125000000,At id autem.,92,2023-06-13 18:44:04
478,243,Dokumen Kilometer Warna Velg Jarak,127000000,Officia doloremque error odio aut repellat. Expedita facilis illum nemo fuga accusantium possimus sunt. Dolor aliquid ab quo architecto repellat nobis.,117,2023-06-09 05:18:08
479,87,Cat Pemakaian Original Mesin Asli Km Pakai Full Service Oli,520000000,Eligendi saepe quibusdam asperiores reiciendis a magnam. Officiis esse suscipit accusantium. Suscipit ut nisi minima occaecati.,197,2023-05-16 10:08:12
480,369,Jarak Kredit Pribadi Service Berkualitas Nego,300000000,Ipsum quia reiciendis necessitatibus animi dignissimos sit. A saepe consequuntur occaecati. Ratione numquam facere sequi soluta. Exercitationem incidunt vitae minus inventore autem.,50,2023-05-14 11:14:55
481,233,Cat Stnk Terjamin Warna Tahun Mobil Pemakaian,265000000,Fuga reiciendis vitae fugit tenetur minima. Ex rem esse culpa similique itaque beatae.,106,2023-02-12 18:07:05
482,400,Langsung Siap Berkualitas Harga Mobil,120000000,Quibusdam odit dolores nobis explicabo error quis. Hic nostrum fugit accusamus suscipit eum. Molestiae possimus adipisci nulla odio nam. Cum iste numquam facere ducimus id exercitationem voluptatum.,88,2023-04-05 18:00:50
483,256,Ban Velg Terawat Pakai Mesin,1500000000,Alias accusamus fuga possimus aspernatur. Illum totam quisquam pariatur odit quas.,154,2023-02-14 08:47:22
484,204,Pakai Eksterior Terjamin Velg Tangan Warna Original,123000000,Laboriosam explicabo autem nesciunt ipsam delectus. Natus illum aut.,15,2023-02-21 06:14:34
485,135,Service Asli Murah Dokumen Original,230000000,Nesciunt veniam aperiam incidunt nulla. Veritatis reiciendis velit maxime esse beatae. Unde a perferendis aperiam voluptatem repellendus repudiandae.,33,2023-04-20 21:46:57
486,17,Bekas Nego Pribadi Interior Jual Bukan rental Siap Km,398000000,Tempora nisi quod incidunt. Recusandae minus porro itaque quia quod fugiat.,59,2022-10-13 08:16:57
487,8,Kendaraan Mobil Negotiable Interior Jarang,155000000,Architecto vel suscipit maxime quo. Corporis iusto placeat.,58,2023-07-19 12:11:45
488,169,Berkualitas Langsung Murah Cicilan Mulus Cat Warna Bekas,225000000,Eos placeat dicta dolor sunt ullam laudantium. Nobis omnis id autem nihil optio autem.,77,2022-11-28 03:06:12
489,322,Service Bukan rental Mobil Baru Nego Stnk Kredit Langsung Terawat,181000000,Ex sed quis minus saepe sunt. Velit doloribus fuga. Repellat nulla deserunt nihil tempora sit consequuntur.,48,2023-06-20 05:22:48
490,242,Terjamin Kendaraan Asli Oli Km Baru Kondisi Pakai,230000000,Odit tempore delectus sit impedit placeat illo. Officia et dolores qui alias dolor cum. Facere facilis id provident ut.,89,2022-08-27 22:05:10
491,58,Terawat Service Harga Warna Kendaraan Tangan Pribadi,520000000,Vel quisquam id quidem explicabo. Dicta sapiente mollitia dicta fugiat expedita nam. Possimus neque asperiores provident est.,62,2022-09-29 18:39:14
492,241,Kondisi Original Harga Pakai Siap Cash Bukan rental,398000000,Deleniti nisi officiis omnis eius eos. Odit consequuntur illo ad commodi voluptatum sapiente. Vero deleniti voluptatum et sit dignissimos quisquam molestiae.,169,2022-10-16 15:19:53
493,73,Warna Jual Dokumen Siap Murah Kredit Full Oli Kilometer,325000000,Recusandae ex animi dolor est. Officiis quia quaerat fuga magnam assumenda harum.,136,2023-01-25 06:37:14
494,52,Jarak Terjamin Jarang Dp Full Tahun Kredit Interior Velg Pribadi,825000000,Nam expedita voluptatem.,51,2023-05-24 05:04:45
495,19,Kilometer Asli Tangan Terjamin Terawat Original Stnk Harga Interior Surat,190000000,Quia rem laborum impedit eligendi. Repudiandae porro accusantium voluptatum.,63,2022-12-28 05:13:00
496,86,Jarak Dokumen Asli Kendaraan Kondisi,850000000,Culpa officiis incidunt ex fuga ea quasi. Maxime quo natus odio praesentium unde eveniet. Mollitia temporibus eaque vitae eaque dolore.,64,2022-10-09 10:49:27
497,246,Pakai Mesin Bekas Kondisi Kilometer Terawat Baru Dp Jarang,200000000,Deserunt quod adipisci cum saepe accusantium vitae nisi. Occaecati dignissimos at aliquam doloremque nihil tenetur. Delectus maxime ipsa fugit.,54,2023-01-25 22:09:21
498,161,Siap Warna Terawat Cicilan Nopol Tahun Velg Mobil,120000000,Ducimus nihil accusantium. Vitae amet dignissimos nobis consequuntur accusantium. Ab blanditiis sequi aspernatur debitis eius.,73,2023-03-26 17:31:00
499,130,Bukan rental Nego Kredit Bekas Km Mesin Pajak,375000000,At nobis non. Ipsa culpa quae sapiente vel laborum repudiandae. Minima veritatis itaque asperiores a.,90,2023-04-14 06:29:17
500,190,Km Original Pajak Tangan Nego Cicilan Nopol,450000000,Molestias debitis ab incidunt quas amet exercitationem temporibus. Ad dolorum optio officia magni. Dolorum dolore labore laboriosam. Explicabo ut numquam veniam.,69,2023-04-21 16:17:06
