ad_id,user_id,title,price,description,car_id,date_posted
130,290,Langsung Stnk Eksterior Velg Siap Nego Original Kendaraan,1350000000,In doloribus voluptates nisi sapiente. Dolorem deleniti explicabo.,95,2023-04-26 16:04:19
131,378,Siap Jarak Kondisi Berkualitas Interior Nego Full Asli,210000000,Possimus modi asperiores nam similique. Repellendus harum facilis eaque ab autem ipsam expedita.,146,2023-05-09 17:20:29
132,370,Cat Mesin Harga Tahun Warna Kondisi Nopol Original Full,225000000,Corrupti modi quos illo vitae odit. Hic tempore rem neque.,54,2022-10-20 13:54:16
133,141,Pajak Jual Harga Dokumen Berkualitas Asli Terawat Cat Bukan rental Dp,155000000,Quo perspiciatis eum. Qui nulla accusamus tempore sunt ex nulla quisquam. Corrupti dicta ab iure magni dolore magni.,82,2023-07-07 16:02:39
134,366,Jarak Kondisi Kendaraan Interior Mulus Jarang Eksterior Service Bekas,470000000,Praesentium illo dolores non iusto ratione commodi. Labore veritatis exercitationem. Dicta nobis sint.,169,2023-05-18 07:52:59
135,217,Service Surat Interior Jual Mobil Baru,1700000000,Delectus consectetur cumque. Itaque dolor quibusdam neque vel. Rem illum totam vero sit rerum repellat commodi.,107,2022-09-13 15:31:47
136,213,Ban Original Tahun Dp Bekas Interior Mulus Murah Nopol,1450000000,Consequatur voluptates vitae. Ex cumque accusamus fugiat corporis ab. Reprehenderit error quo aliquid facilis libero commodi.,45,2022-10-30 04:45:01
137,377,Pribadi Km Kredit Terawat Harga,125000000,Quisquam quam earum. Ad quaerat maiores placeat. Cumque commodi aliquam nam.,57,2023-04-02 13:58:48
138,350,Ban Mesin Velg Surat Bukan rental Tahun Pajak Baru Eksterior Service,285000000,Quasi enim natus ipsum eum impedit error iure. Natus fugiat ea.,114,2022-12-18 20:02:19
139,131,Service Cicilan Mobil Full Dokumen,520000000,Inventore iusto deleniti quis tempore. Esse sequi fugit expedita nulla.,62,2023-05-01 02:53:25
140,266,Full Pemakaian Jual Murah Terjamin Mobil Mesin Tangan,230000000,Itaque reprehenderit sunt voluptates odit asperiores ipsum recusandae. Minima reiciendis molestiae exercitationem dolorem.,144,2023-03-30 14:02:55
141,305,Mulus Cat Oli Bekas Kondisi Pribadi Berkualitas,325000000,Nostrum placeat praesentium voluptatum itaque ducimus dolores soluta. Rem amet tenetur vitae. Totam delectus deserunt similique totam ratione officiis.,136,2023-01-25 14:22:06
142,206,Cat Kilometer Tahun Kondisi Terjamin Langsung Jarak Pemakaian Full Dp,520000000,Soluta quas aperiam alias reprehenderit vel voluptatibus. Sed magnam mollitia nemo repellendus animi libero assumenda.,197,2022-08-16 10:23:08
143,160,Kendaraan Nopol Mulus Oli Siap Jual Baru Tangan,125000000,Libero delectus ab adipisci exercitationem. Labore nisi iure magnam unde officia soluta.,195,2023-02-02 15:56:06
144,392,Pajak Surat Pribadi Jarak Service Pemakaian Original Murah,1700000000,Sequi explicabo nemo voluptatem nisi molestiae adipisci. Iusto laudantium eius iusto vitae rerum nam perspiciatis.,170,2023-06-04 15:38:43
145,367,Oli Jual Pemakaian Kendaraan Service Full Siap Kondisi,212500000,Accusamus veritatis dolorum dignissimos quam expedita ipsa. Esse dolore aspernatur nobis quo.,173,2022-12-11 06:07:35
146,203,Interior Kilometer Bukan rental Tangan Nego Dp Berkualitas Langsung,110000000,Quasi quibusdam quae exercitationem corporis quisquam non. Dolorum iure veritatis dolor.,178,2022-12-06 05:25:18
147,312,Negotiable Ban Cicilan Jarang Eksterior Berkualitas Cat Kredit Terjamin,850000000,Dicta repudiandae molestias consectetur. Magni reprehenderit saepe reiciendis. Molestias possimus dolor.,74,2023-05-15 05:22:22
148,80,Jual Pemakaian Tangan Kilometer Mobil Baru Pakai Dp,159000000,Rerum deleniti alias adipisci tenetur.,1,2022-11-21 12:42:01
149,308,Berkualitas Terawat Surat Tahun Pemakaian Bekas Pakai Terjamin,590000000,Ratione assumenda dolore ducimus molestias maiores nemo. Eligendi facilis laboriosam eaque laudantium fuga commodi debitis.,96,2023-02-07 03:53:55
150,84,Service Terjamin Mobil Interior Dokumen Pribadi Velg Surat,450000000,Officiis ipsam illo repellat quia impedit. Odit porro debitis veniam est.,70,2023-07-03 03:34:05
151,207,Berkualitas Dokumen Kredit Warna Nego Siap Asli Tahun Kilometer,107000000,Dicta nesciunt iure tempore exercitationem ex nam. Quam facilis voluptas autem. Autem provident at nisi suscipit odio dignissimos.,49,2022-12-31 23:41:02
152,9,Service Full Interior Siap Baru Jual,210000000,Soluta perspiciatis iste ut dolorem enim voluptas numquam. Minus numquam ratione deleniti voluptas.,146,2023-06-14 02:58:28
153,47,Dokumen Cash Surat Kredit Km Warna Kilometer Stnk Asli Berkualitas,230000000,Cupiditate voluptas doloribus laborum molestias. Minus consequatur voluptates earum sit.,33,2023-02-23 07:03:08
154,240,Mulus Mesin Negotiable Ban Dp Warna Original Tangan Baru,1625000000,Sapiente hic non dolorum. Culpa provident dolore sint odit fuga pariatur. Iure sit dicta alias aut animi tempore.,199,2022-12-19 09:21:53
155,277,Kendaraan Harga Negotiable Cicilan Kondisi Siap Velg,850000000,Voluptatem ratione cum velit mollitia possimus maxime. Sunt facere nostrum non incidunt odio nihil. Rem suscipit perferendis optio debitis.,69,2023-04-27 01:09:51
156,112,Mesin Km Negotiable Kendaraan Nopol Cicilan Pemakaian,1700000000,Asperiores quaerat quae asperiores. Itaque soluta odio assumenda. Animi inventore dolore ipsa.,107,2023-03-18 04:40:23
157,307,Mesin Tangan Cash Cicilan Cat Kondisi Km Kendaraan,125000000,Nam sint culpa ea ipsam. Ratione fuga ipsam labore. Nisi ut saepe ad harum tempore magni.,193,2023-05-01 21:27:47
158,22,Nego Jarang Terawat Terjamin Kilometer,230000000,Placeat rerum earum aliquid. Sunt voluptas debitis repellendus quidem optio cumque.,121,2023-05-10 17:31:18
159,281,Full Original Eksterior Asli Berkualitas Km Interior,127000000,Deserunt ad cum veritatis. Deserunt ab aperiam sequi.,117,2023-02-06 08:49:59
160,320,Original Dp Mobil Murah Tangan,1450000000,Tempora ipsam laudantium facilis sint nisi neque. Ipsum maiores quo eos. Velit mollitia alias recusandae velit.,45,2022-11-12 14:24:12
161,70,Service Warna Km Kendaraan Pajak Jual Nego Interior Bukan rental Mulus,365000000,In blanditiis eos aliquam et. Cum distinctio et repellat rem voluptatum. Corrupti iste adipisci quaerat sit tempore fugit.,84,2022-12-30 09:26:24
162,45,Cat Surat Baru Negotiable Kondisi Terjamin Cicilan Tangan Bukan rental,110000000,Cupiditate ex blanditiis possimus beatae. Beatae deserunt suscipit. Natus dolorem modi velit optio aut.,35,2023-01-28 06:16:14
163,4,Negotiable Dokumen Terawat Service Ban Langsung Pajak Cash Jarang,325000000,Deleniti perspiciatis dignissimos sunt. A consectetur odio numquam.,34,2023-01-24 17:54:07
164,96,Terjamin Interior Jarak Pribadi Kondisi Pakai Negotiable,185000000,Quidem repellendus recusandae dolore a error. Eligendi sit alias laudantium. Consequuntur vero vel deserunt excepturi.,86,2022-10-10 08:59:28
165,299,Cicilan Jual Cash Nopol Mobil Nego Full Bukan rental,199000000,Ex aliquid laborum corrupti odit quis. Amet provident illum beatae.,38,2023-02-10 06:05:12
166,168,Kendaraan Bukan rental Terawat Interior Jarang Murah Velg,100000000,Quod ullam dolore deleniti. Tenetur adipisci consectetur tenetur ipsa expedita. In inventore quibusdam et commodi.,39,2023-03-23 11:43:50
167,185,Cicilan Mesin Pemakaian Oli Kredit Surat Kondisi Dokumen,147500000,Asperiores dolorum sequi quas ullam dignissimos dolores. Animi facilis placeat occaecati voluptates ut.,11,2023-02-27 01:32:45
168,125,Bekas Velg Kondisi Baru Jarang Pemakaian Tahun Full,463000000,Beatae quo vero ipsam ea. At aliquid commodi enim. Nemo perferendis cumque saepe deserunt beatae.,41,2023-05-18 21:39:56
169,393,Velg Tahun Siap Cicilan Jarang,5800000000,Doloribus commodi quisquam totam laboriosam. Voluptates iste quis rem molestiae saepe. Eos debitis sint incidunt. A eaque consectetur laudantium eum distinctio voluptatibus.,36,2023-03-16 19:31:34
170,339,Langsung Cicilan Dp Cash Warna Bekas Stnk Pakai,1295000000,Dolorum odit maxime asperiores dolorum voluptatum.,99,2023-02-11 07:47:31
171,74,Stnk Tangan Surat Jual Velg Jarak Kilometer Mulus Eksterior,190000000,Assumenda corporis vel. Ex quia deleniti asperiores.,16,2022-11-28 00:10:53
172,339,Surat Negotiable Terjamin Jarak Siap Oli,220000000,Corporis dolor veritatis eos veritatis tempora ut a. Sapiente nam non. Optio cumque animi ullam aliquid quos.,19,2023-02-05 03:59:38
173,198,Tahun Dp Kondisi Pemakaian Pajak Km,212500000,Veritatis nemo accusamus dolore. Reprehenderit nemo deserunt vero.,173,2023-01-07 16:24:49
174,103,Bekas Cash Murah Nego Pajak Berkualitas Terawat,197000000,Saepe pariatur ad rem accusamus eaque alias odit. Dolores placeat reprehenderit temporibus eius quas.,161,2023-02-07 03:15:08
175,19,Full Kondisi Kendaraan Jarak Dp Ban Jarang Harga,120000000,Voluptate dolor praesentium laboriosam facere deleniti reprehenderit est. Perspiciatis natus laborum pariatur officiis eveniet officia. Praesentium accusamus enim neque in accusamus culpa.,73,2023-05-31 01:46:15
176,171,Berkualitas Terawat Jarang Kredit Pajak,470000000,Esse sit optio. Facere minima quibusdam eum vitae similique voluptate.,84,2023-03-07 07:12:13
177,95,Cat Interior Terjamin Jarang Kondisi Km Kredit Pajak Cicilan,600000000,Sit tenetur voluptatem asperiores cumque. Velit at corrupti sit.,29,2022-10-11 09:16:36
178,286,Interior Tahun Jual Kredit Kendaraan Berkualitas,1295000000,Natus dignissimos ullam quasi voluptas ea consectetur blanditiis. Magnam velit voluptatem voluptatum veniam suscipit iste. Nobis commodi beatae itaque.,99,2022-11-29 23:31:53
179,205,Kondisi Warna Service Oli Kilometer Pajak Interior Full,135000000,Tenetur voluptate dolores commodi. Quas quasi error ratione provident. Quaerat illo exercitationem saepe.,58,2022-09-05 02:12:10
180,255,Nopol Dokumen Bekas Cash Mobil Harga,1700000000,Corporis necessitatibus molestiae ipsam molestias neque. Labore iusto eius.,40,2023-03-11 17:16:36
181,196,Full Pajak Mobil Eksterior Asli Jarang,1100000000,Non aspernatur blanditiis cumque veniam reiciendis. Numquam numquam reprehenderit sequi est nam vel. Occaecati debitis excepturi.,151,2023-07-07 03:20:55
182,339,Kendaraan Velg Full Stnk Dokumen Pajak Pemakaian Km Kredit Tangan,230000000,Cum nesciunt at odit culpa quod enim enim. Autem consequuntur sunt.,66,2023-04-25 02:58:15
183,360,Kendaraan Surat Cicilan Pemakaian Murah Original Negotiable Velg Km,130000000,Non dolorem suscipit labore.,25,2023-03-07 01:39:18
184,253,Murah Surat Eksterior Pakai Harga,130000000,Quis asperiores repudiandae adipisci perspiciatis sit provident. Dolor iusto eaque quaerat.,25,2022-11-11 03:43:50
185,1,Eksterior Cicilan Nopol Asli Harga Cash Jarak Stnk,463000000,Molestias impedit officiis qui ipsa omnis. Nihil blanditiis quo perspiciatis sint saepe ipsa. Adipisci vel optio sunt. Ipsa repellat debitis suscipit animi nobis accusantium.,62,2023-02-05 20:23:13
186,124,Murah Warna Kredit Dokumen Bekas Siap,254000000,Veritatis aut odio aliquid tenetur. Quod ullam voluptatibus dolor.,109,2023-03-24 17:30:17
187,176,Tangan Terawat Kredit Jarak Tahun Ban Negotiable Service Dokumen Nego,1450000000,Veniam corporis enim asperiores amet aspernatur. Cum dolor distinctio adipisci. Quos sapiente eligendi quis debitis mollitia.,194,2023-01-02 02:21:50
188,337,Negotiable Terjamin Baru Oli Pajak Murah Terawat Stnk,146000000,Sequi cupiditate quibusdam exercitationem laboriosam. Repellendus exercitationem laudantium culpa.,173,2022-10-23 00:59:19
189,229,Dokumen Nego Original Tangan Kilometer,125000000,Commodi animi expedita animi. Nisi mollitia autem accusamus.,193,2023-03-07 15:22:50
190,309,Harga Km Terawat Pakai Interior Jarak Service Oli Terjamin Nego,120000000,Eaque animi aspernatur repellendus dolore tempore impedit. Tempora quisquam reiciendis modi voluptatum reiciendis officiis accusantium. Dolorum amet ratione consequuntur velit. Tempore ad repudiandae ipsam velit aperiam inventore.,88,2022-12-22 17:15:02
191,104,Km Kilometer Pemakaian Pribadi Jarak Terjamin Bukan rental Kendaraan,230000000,Fugiat omnis eius eum ipsam sint ut. Expedita aspernatur modi magnam.,55,2022-12-18 04:45:52
192,302,Kendaraan Dp Eksterior Surat Berkualitas Oli Mulus Cat Pemakaian Siap,125000000,At distinctio ut at unde. Repellendus sint sit minus rerum tenetur.,183,2023-06-13 16:08:11
193,161,Kendaraan Surat Service Velg Full Pribadi Baru Siap,180000000,Veritatis quia cupiditate ad fugiat sequi. Omnis incidunt quod assumenda. Ipsa dignissimos esse animi voluptatem assumenda.,66,2022-12-30 22:16:49
194,358,Km Dokumen Bukan rental Jarang Mulus Harga Jual Murah,1295000000,Omnis cum culpa culpa ut nam iste. Fugit voluptate nam placeat doloremque quibusdam.,99,2023-04-11 03:25:12
195,361,Pajak Velg Dokumen Pakai Interior Negotiable Mobil,440000000,Maxime veniam natus voluptates quae. Repudiandae autem veniam culpa ipsam voluptatem. Fugiat laudantium magni at at.,21,2023-06-14 18:58:06
196,374,Pemakaian Eksterior Harga Km Cat,2750000000,Quod qui atque laboriosam id deleniti iste dolor. Deleniti laboriosam quas sint voluptatibus velit.,190,2023-01-31 16:45:34
197,368,Stnk Tangan Nopol Km Kondisi,135000000,Officiis dolorem odio sequi eos. Quam qui ducimus consectetur dolorem quo nam.,113,2022-11-23 01:49:44
198,112,Surat Warna Pajak Oli Jual Tahun,450000000,Pariatur optio dignissimos cumque. Necessitatibus repellat sed. Excepturi odit placeat debitis nulla.,29,2023-02-06 05:04:22
199,208,Original Jual Terjamin Pribadi Full Eksterior Warna Nopol Kilometer Interior,910000000,Nesciunt aliquam suscipit officia aperiam laudantium. Consequuntur tenetur excepturi et. Illo quasi voluptatem aliquid natus.,129,2023-03-28 22:18:12
200,114,Mesin Jarak Oli Bukan rental Cash Langsung Kendaraan Dokumen Terjamin Terawat,147500000,Corrupti nesciunt minus inventore eius fugit. Id quis laudantium illo sed. Excepturi labore a quibusdam enim dolorum iste.,85,2023-04-13 13:36:35
201,384,Kredit Cicilan Asli Surat Siap Murah Stnk Terawat Mesin Dokumen,130000000,Id aut unde facilis provident. Atque inventore iste dolorum earum voluptatum culpa modi.,80,2023-02-15 13:34:53
202,240,Interior Cat Berkualitas Harga Pakai Km Cash Dokumen,245000000,Eum culpa ab placeat repellat. Sint possimus a aperiam ullam vel dicta. Repellat quam cumque ad. Autem sunt sit.,189,2022-09-29 06:17:50
203,315,Mesin Surat Interior Asli Oli Bukan rental Negotiable Warna,139000000,Reprehenderit vero quos consequatur neque quas recusandae. Quia quas ab enim ex ratione tempore amet.,82,2023-02-21 09:33:45
204,369,Kilometer Nopol Surat Langsung Mobil Cat Tahun Terjamin Pajak,325000000,Cum in occaecati. Ipsa quas necessitatibus perferendis corrupti cum.,136,2023-01-31 05:37:44
205,262,Baru Kilometer Pakai Murah Original Langsung Pemakaian,590000000,Rerum facilis ut aliquid officia id. Dignissimos vitae officiis dolorem dignissimos.,97,2023-06-22 05:39:22
206,23,Stnk Bekas Velg Warna Mobil Pemakaian Oli Langsung Dp Bukan rental,850000000,Eum eligendi deleniti suscipit enim distinctio dolor. Fugiat exercitationem ex excepturi.,120,2023-04-20 12:44:13
207,37,Surat Oli Tangan Nego Ban,470000000,Totam dolorem sit omnis.,148,2023-08-08 08:43:36
208,150,Ban Eksterior Pakai Jarang Jarak Kredit Mulus Langsung,159000000,Adipisci quasi ipsa aut. Magni dolore laborum ea molestias placeat recusandae illum.,1,2023-01-22 02:06:19
209,249,Murah Pemakaian Nego Asli Surat Pajak Full Tahun Kilometer,154000000,Laboriosam assumenda minima. Corrupti magnam maxime dicta.,28,2023-03-17 13:19:49
210,65,Pribadi Velg Warna Pajak Terawat Dokumen Tangan,230000000,Quam reprehenderit voluptatem alias iusto incidunt. Sed dolor in debitis voluptatum autem magni occaecati. Est quia aspernatur ipsum nisi a.,200,2023-04-07 13:13:48
211,179,Stnk Mulus Negotiable Velg Cicilan Dokumen Tangan Bekas,1650000000,Nesciunt eos facere voluptates accusamus quidem. Ipsam veniam nihil minima itaque.,138,2023-01-09 06:03:59
212,226,Tahun Cash Pribadi Kondisi Original Mobil,199000000,Reiciendis pariatur iste repellat fuga fugiat. Inventore dolorem ab repellat. Id eligendi omnis accusamus.,104,2023-02-18 00:23:24
213,252,Harga Cicilan Nopol Negotiable Jarak Mulus Berkualitas Asli Jual Nego,355000000,Nobis quas veniam quidem. Nam vel quisquam placeat. Necessitatibus vitae nobis corrupti laboriosam rem accusamus. Itaque ab libero reprehenderit vel accusamus.,147,2023-05-06 00:36:04
214,283,Bukan rental Km Murah Siap Langsung Pemakaian Cash Berkualitas Tahun Warna,860000000,Deserunt consequuntur officiis quo iste. Quo corporis molestias magni.,68,2022-12-06 19:15:44
215,143,Mulus Nopol Terjamin Cicilan Jarak,398000000,Cupiditate illo fugit vero. Impedit ratione magnam ab. Rem suscipit nemo doloremque similique molestiae tempora.,156,2023-01-03 05:35:39
216,205,Murah Pakai Dp Negotiable Berkualitas Full Baru Jual Pribadi Surat,147500000,Vel in inventore eum quibusdam corrupti sint fuga. Praesentium quaerat vel eaque perspiciatis cupiditate numquam provident. Veritatis soluta facere.,187,2023-04-03 11:13:26
217,316,Kilometer Nego Mobil Pemakaian Ban Oli Mesin Interior Terawat Dp,975000000,Officiis fugit beatae suscipit et. Dolorum repellendus quaerat possimus.,93,2022-12-30 12:58:50
218,252,Oli Stnk Pajak Eksterior Mobil Tahun Pribadi,1750000000,Voluptas dolore consequatur tempora rem quasi ad.,145,2022-10-09 05:57:42
219,167,Terawat Kredit Jual Pakai Warna Interior Service Original,440000000,Velit odio nesciunt non modi ut ullam. Natus minus nihil. Illum doloribus mollitia sunt saepe eius.,34,2022-11-27 04:01:05
220,134,Eksterior Service Tangan Pakai Velg,130000000,Molestias blanditiis repellendus reiciendis ipsam. Minima excepturi earum quidem rerum rem dolorum. Et est repudiandae similique dolor voluptatibus. Ipsa recusandae tempora iure.,82,2022-12-14 15:03:36
221,119,Baru Jarang Interior Jarak Asli Cicilan,200000000,Eum dolorum nemo. Accusantium magnam asperiores beatae et.,44,2023-01-06 16:33:27
222,395,Eksterior Surat Jarang Jual Mulus Pakai Baru Nopol Cat Kendaraan,440000000,Voluptatum rem ipsum occaecati. In voluptatibus eum veritatis. Atque a quo maxime nostrum nesciunt nulla occaecati.,136,2022-08-27 01:56:12
223,175,Km Pakai Terawat Tahun Terjamin Service Murah Warna Negotiable Siap,850000000,Incidunt expedita fuga laboriosam debitis corrupti vitae. Molestiae deleniti incidunt dolorem tenetur culpa ex. Ea enim animi deleniti.,119,2023-04-23 09:52:38
224,81,Mulus Mobil Pribadi Velg Tangan Berkualitas Ban,167000000,Ab esse nemo mollitia inventore culpa odio pariatur. Et ea tempora consequatur maxime esse.,126,2023-04-10 14:49:41
225,33,Cash Siap Nopol Murah Mobil Cicilan Full,146000000,Consectetur iure neque veniam vel. Error eos veritatis alias maxime tempora repudiandae. Laudantium aut repellendus nobis temporibus inventore explicabo.,46,2022-11-19 08:45:05
226,238,Negotiable Harga Kendaraan Kondisi Dokumen Velg Mulus Jual Warna Cicilan,230000000,Nostrum itaque doloremque architecto accusantium dolorum quia. Quis dolore quasi. Praesentium enim asperiores.,66,2022-11-14 14:19:00
227,161,Stnk Bekas Kilometer Eksterior Berkualitas Pakai Nopol Baru Negotiable,125000000,Beatae vel nesciunt facere commodi. Assumenda voluptatibus earum libero laboriosam alias vel tenetur.,131,2023-04-15 10:23:06
228,294,Jarang Mulus Asli Baru Nego Cicilan Ban Kondisi,600000000,Quam quibusdam error veniam veritatis. Animi dolore molestias possimus similique.,3,2023-03-17 11:50:51
229,79,Kendaraan Bukan rental Kredit Pemakaian Bekas Murah,679000000,Odit nihil quod repudiandae. Architecto iusto earum alias.,141,2023-05-01 04:19:57
230,20,Pribadi Oli Negotiable Kredit Cash Service Ban Mulus Surat Harga,2575000000,Sit maiores quidem porro provident perferendis earum. Esse nisi ab ducimus doloribus mollitia. Iure inventore ab sequi aspernatur eum officia.,142,2023-02-12 04:35:47
231,400,Km Pakai Service Nego Eksterior,215000000,Recusandae alias magnam dolores. Optio culpa inventore perferendis dolorum suscipit recusandae. Beatae molestiae quibusdam aliquid.,35,2023-01-12 00:32:23
232,316,Service Mesin Cash Pemakaian Bukan rental Pajak Baru Langsung Terjamin Stnk,440000000,Rerum provident reiciendis quibusdam beatae cum. Eaque ex eveniet quae.,34,2023-04-30 15:42:00
233,309,Dp Kendaraan Pribadi Ban Terawat Murah Kredit,679000000,Odit asperiores nobis ipsa temporibus. Odio asperiores totam numquam illum exercitationem.,180,2023-03-26 15:54:12
234,347,Dokumen Nopol Mesin Baru Harga Bukan rental Cicilan,470000000,Impedit id at numquam necessitatibus. Enim placeat fugiat.,148,2023-03-06 09:36:30
235,373,Cash Berkualitas Pemakaian Baru Surat,135000000,Eos architecto at quae quibusdam. Qui eum doloribus consequuntur occaecati corporis pariatur. Asperiores tenetur ducimus.,23,2023-06-03 03:34:37
236,156,Pemakaian Terjamin Stnk Cash Warna Ban Pakai Nopol Cat,159000000,Voluptatem nemo mollitia. Laudantium placeat magnam corporis temporibus laboriosam amet officia. Autem minus quo. Iste ea amet reiciendis ratione.,47,2023-02-22 08:14:15
237,294,Service Murah Jarang Velg Dp Cicilan Pajak Berkualitas,1700000000,Quam ratione et inventore quasi dignissimos. Officia tempora debitis occaecati reprehenderit cupiditate. Odit tenetur sed aut iure asperiores.,149,2022-11-25 18:50:45
238,269,Kendaraan Kondisi Terjamin Bekas Pemakaian Terawat Nopol Stnk,100000000,Fugit molestiae odit facilis facere.,8,2022-11-23 12:05:45
239,84,Kilometer Kondisi Pribadi Cicilan Ban Interior Surat Oli Jual Cash,1350000000,Delectus deserunt error harum repudiandae. Optio accusamus magnam.,145,2023-07-24 16:19:02
240,227,Mesin Dokumen Harga Kendaraan Kondisi Warna,398000000,Cum fuga illum voluptate. Dolores soluta dicta doloremque.,159,2023-02-28 11:19:42
241,17,Terawat Terjamin Pakai Jual Jarak Baru,195000000,Quo placeat quisquam. Aliquam animi dignissimos.,31,2023-01-09 14:15:19
242,37,Km Ban Kredit Pakai Murah,2750000000,A optio ducimus facilis ratione. Nulla sint reiciendis eos nemo.,19,2022-12-22 03:18:05
243,139,Nopol Mesin Terawat Full Oli Kredit Ban Original Bekas,775000000,A soluta officiis eaque similique illo beatae. Reiciendis architecto consequuntur quia vitae itaque.,141,2023-01-07 05:38:59
244,24,Nego Kendaraan Interior Kilometer Mulus Negotiable,775000000,Recusandae enim velit eum. Porro cupiditate soluta officia. Perspiciatis eius quaerat tenetur pariatur eos.,141,2023-06-12 17:43:19
245,330,Berkualitas Baru Km Cash Interior Kendaraan Original,135000000,Saepe dolorum beatae commodi hic inventore. Fuga nostrum neque alias deserunt. Saepe nisi vitae eius eum distinctio deserunt.,57,2023-03-06 00:44:00
246,133,Bekas Dp Kredit Terawat Pemakaian Pajak,230000000,Enim veritatis totam fugiat quis alias consequatur.,20,2022-10-05 09:46:40
247,133,Siap Bekas Jarang Eksterior Jual Cicilan Interior Terjamin Harga Kondisi,212500000,Consequatur minus rerum illum dolores veniam. Quaerat reprehenderit quasi debitis distinctio tenetur.,168,2022-11-02 19:38:35
248,226,Jual Velg Warna Mulus Murah Jarak Dp Full,120000000,Repellendus reiciendis natus quisquam deserunt soluta deleniti. Laborum voluptatem consequuntur eaque quisquam vel. Dolorum quasi voluptatibus dolore iure.,101,2023-04-11 12:17:53
249,280,Kredit Cicilan Surat Terjamin Bukan rental Siap,220000000,Fugit numquam possimus labore. Facilis sequi eius harum saepe dolore. Laudantium illo laboriosam veritatis iusto.,174,2022-12-16 19:08:52
250,59,Berkualitas Mulus Kondisi Terjamin Harga Cicilan Service Pakai,230000000,Voluptatibus nihil praesentium placeat asperiores. Voluptate itaque nobis necessitatibus debitis suscipit quae.,33,2023-05-09 01:25:02
251,72,Berkualitas Terjamin Kilometer Service Nego Stnk,150000000,Eum a quaerat exercitationem vero ullam debitis saepe. Voluptatibus doloribus impedit voluptatibus hic. Earum deserunt excepturi expedita.,111,2023-02-03 10:57:37
252,166,Stnk Warna Tahun Berkualitas Eksterior Pribadi,1700000000,Necessitatibus tenetur ratione accusamus cupiditate vero eaque. Cupiditate quas ipsa.,110,2023-01-04 22:05:34
253,204,Km Mobil Original Kredit Interior Asli,500000000,Laudantium ratione cumque excepturi veniam dolores.,90,2023-06-08 13:24:49
254,225,Berkualitas Langsung Ban Kondisi Nopol Terawat Service,1845000000,Voluptate sed iusto dicta voluptatem. Earum optio iste eius earum. Porro quaerat qui.,194,2023-01-28 10:32:24
255,56,Negotiable Jarak Tangan Ban Stnk Dp,300000000,Sunt quasi veniam dolorum. Nemo expedita voluptas veniam.,114,2023-07-12 14:04:20
256,354,Surat Pakai Dokumen Kredit Tahun Mulus Siap Eksterior,95000,Magnam deserunt natus alias pariatur. Officia officia voluptatem perferendis debitis expedita dolores dolor.,49,2023-04-16 15:52:36
257,171,Kondisi Berkualitas Nego Eksterior Terjamin Stnk,254000000,Quisquam ad dolor saepe ex nobis praesentium. Unde laboriosam et quisquam excepturi totam corporis. Illum quod explicabo doloremque sequi mollitia sapiente expedita.,196,2023-05-29 22:46:22
258,251,Mobil Baru Terjamin Cat Pajak Surat Pribadi Kendaraan,200000000,Suscipit eum blanditiis eum provident. Sapiente voluptates tenetur nobis ratione.,44,2022-10-29 20:39:00
259,297,Full Mesin Jual Kredit Siap Asli Berkualitas Km Kondisi,225000000,Error consequuntur voluptatum quos quis voluptate repudiandae exercitationem. Laboriosam pariatur sed. Nobis similique vitae cum ipsam.,44,2023-07-01 21:59:11
260,242,Mobil Velg Asli Tahun Jual,100000000,Cumque esse fugit eius. Accusantium atque sit officia assumenda eum.,118,2023-03-15 02:44:57
261,202,Nopol Mobil Jarang Nego Oli Berkualitas Dp Siap Interior Cat,5800000000,Facilis illo doloribus minus aperiam fuga perspiciatis. Unde ab nisi. Maiores ipsam amet pariatur magni earum exercitationem.,177,2023-03-02 20:47:42
262,280,Full Eksterior Stnk Pribadi Langsung,300000000,Quas optio libero iusto. Omnis possimus saepe assumenda magnam.,153,2023-03-01 14:07:35
263,203,Interior Jarak Pajak Kondisi Ban Murah Pribadi Full Nego Bekas,181000000,Omnis cumque fugiat nulla dolorum. Facilis rerum dolor excepturi.,143,2023-06-28 07:35:43
