ad_id,user_id,title,price,description,car_id,date_posted
1,202,Jarak Mesin Kondisi Nego Ban Eksterior Kendaraan Langsung,675000000,Nihil dicta fuga beatae fuga fuga. Iste autem unde suscipit iure.,127,2023-06-26 00:21:23
2,102,Baru Terjamin Bekas Cat Murah Interior Service Negotiable,155000000,Fugit similique magnam commodi. Labore quos nostrum fugit nobis.,113,2023-03-16 07:34:15
3,105,Cat Harga Ban Pribadi Original Dp Surat Pajak Tangan,510000000,Ipsa officiis ratione non est voluptatibus quisquam. In accusantium quae alias beatae quisquam.,5,2022-11-14 06:04:13
4,325,Stnk Warna Pemakaian Langsung Oli,245000000,Non minima dolorem adipisci asperiores sint. Maxime earum repellat eligendi aperiam.,136,2023-02-26 05:43:22
5,266,Dp Nopol Tahun Ban Kilometer Stnk Kendaraan,500000000,Asperiores est numquam illo. Voluptatibus eum dicta illo.,123,2023-01-31 15:34:17
6,278,Tahun Cat Terjamin Mesin Jarang Service Bukan rental Pribadi,550000000,Deleniti omnis voluptas perferendis enim. Quod alias ducimus officia consequuntur. A sunt ad a commodi dolores.,22,2023-01-26 06:16:12
7,331,Baru Pemakaian Kilometer Jual Berkualitas Mulus Service,100000000,Asperiores ullam dolorem officiis nobis voluptate. Dicta quam odit doloribus impedit.,165,2023-02-19 08:14:07
8,213,Langsung Nopol Jual Pakai Baru,910000000,Harum vel non fugiat sapiente tempora. Quod temporibus et quos minus. Commodi reiciendis sit veritatis quaerat esse ullam.,171,2023-03-09 19:25:47
9,379,Warna Pemakaian Dp Berkualitas Pribadi,120000000,Ducimus ut dignissimos cum sequi. Dolorum quasi architecto praesentium impedit illum enim. Amet architecto nobis neque consectetur ex atque.,101,2023-05-09 23:54:51
10,128,Mobil Service Murah Pribadi Kendaraan Langsung Kilometer,5800000000,Repellat sunt tempore explicabo aperiam libero. Nam eveniet et animi quasi neque. Rem adipisci amet provident eum.,36,2023-06-13 21:08:59
11,281,Jarak Cat Terawat Service Velg Pemakaian Dp Kondisi Cicilan,135000000,Impedit cumque vitae laboriosam optio fugiat sunt. Harum dolor iusto voluptas iste accusantium voluptate. Sapiente temporibus vero expedita quam. Adipisci dolor deserunt ipsam.,131,2023-01-15 01:42:38
12,91,Berkualitas Stnk Baru Terjamin Mulus Velg Dokumen Cat,155000000,Animi voluptate commodi. Quidem aut non expedita. Deserunt illum totam molestias cum beatae officiis.,195,2022-10-16 05:46:53
13,307,Kendaraan Service Jarak Langsung Interior Murah Tangan,800000000,Inventore voluptatem quam natus. Itaque occaecati neque laudantium aspernatur expedita aut.,81,2023-03-18 09:49:15
14,24,Dokumen Pakai Baru Berkualitas Kendaraan Mesin Kondisi Oli Bukan rental Tahun,910000000,Modi vel vero recusandae odio. Provident maiores repellat iure. Maxime nemo pariatur culpa.,24,2022-11-18 18:37:51
15,18,Oli Original Terjamin Service Tangan Pribadi Negotiable Terawat,2750000000,Eaque molestias delectus occaecati iusto occaecati veniam nobis. Tempora necessitatibus sit magni mollitia quod autem. Mollitia iure voluptatem unde.,190,2023-06-29 19:32:04
16,41,Murah Mulus Full Mobil Nopol,850000000,Quam quidem non hic porro nemo nihil. Asperiores natus quia dolorem. Suscipit voluptas qui nesciunt totam maiores.,119,2022-12-18 21:21:35
17,322,Terjamin Jarang Murah Mulus Cat Tahun Pribadi Cicilan Bekas,181000000,Minima id consequatur itaque perspiciatis beatae. Laborum laudantium beatae autem voluptatem.,173,2022-11-07 12:31:41
18,85,Warna Cicilan Pajak Pakai Tahun Dokumen Siap Dp Cash,127000000,Animi fugit dicta magnam soluta corporis. Deserunt impedit omnis at. Nemo nisi facilis veniam exercitationem adipisci enim repudiandae. Officiis itaque ipsa porro modi impedit.,187,2022-09-12 05:39:13
19,147,Tangan Murah Eksterior Dp Cicilan Cash Kilometer Asli Langsung,1700000000,Itaque quibusdam in dolor. Quos neque veniam. Ipsam nihil commodi quo ipsum.,170,2023-07-26 23:18:43
20,86,Full Ban Tangan Velg Interior Cat Stnk Pribadi,285000000,Laborum voluptatem sed commodi provident itaque ipsam. Vero fugiat nihil cumque voluptatem iure reiciendis nulla.,114,2023-01-14 02:44:52
21,143,Surat Berkualitas Terjamin Oli Jual Negotiable,297000000,Quis quis voluptatibus dicta. Repellendus laboriosam laborum laboriosam dolorem. Fugiat veniam provident aut minus minima.,91,2022-12-30 04:46:08
22,390,Tangan Kilometer Pajak Dokumen Nego Terawat Oli,260000000,Voluptas quisquam veniam quas. Eum commodi quo dignissimos. Ipsa id temporibus rem.,178,2022-12-21 14:36:15
23,115,Cicilan Tahun Kredit Mobil Jual Service Velg Stnk Kendaraan,850000000,Nobis magnam totam neque reprehenderit. Ratione dolores doloremque non deleniti ipsam officia.,69,2023-05-23 21:49:24
24,355,Cat Terawat Pribadi Cicilan Kilometer Negotiable Tangan Oli Siap,225000000,Voluptatibus eos itaque dignissimos fugit eligendi. Quaerat nulla tempore aliquam. Dolorum autem sit voluptas. Quia commodi eligendi omnis est dolorem vel nesciunt.,44,2023-04-29 22:15:23
25,210,Interior Km Pemakaian Jarak Dp Harga Baru Stnk Cat,215000000,Quos hic provident dolore eos. Architecto labore expedita dolor. Beatae eius ab excepturi iure labore qui aliquid.,55,2023-06-23 08:23:20
26,313,Pajak Oli Kilometer Tahun Cash Berkualitas Siap Asli,195000000,Atque recusandae expedita eius inventore deserunt. Quam eos a aliquid rerum incidunt asperiores.,31,2023-03-31 04:38:26
27,272,Km Berkualitas Negotiable Langsung Original Jarak Tangan,130000000,Maxime illum consequatur nulla ad molestias cum. Laborum rem eos architecto voluptatum molestias culpa.,92,2022-11-13 01:35:52
28,377,Service Jarang Nopol Dp Eksterior,297000000,Quo ratione necessitatibus. Vitae error quisquam esse temporibus corporis deleniti.,78,2022-12-04 07:09:55
29,19,Dokumen Dp Tahun Nego Siap Baru Km Interior Service Berkualitas,775000000,Minima neque explicabo. Assumenda tenetur explicabo nostrum facilis eius.,180,2022-11-29 22:00:28
30,38,Siap Dokumen Langsung Service Berkualitas Cash,215000000,Repellat fuga eveniet deserunt sed nemo quas. Praesentium eveniet id asperiores voluptatibus. Vel provident quia ex dicta distinctio.,178,2022-12-18 19:43:09
31,205,Jarang Mesin Kendaraan Surat Nopol Murah Velg,1100000000,Ab quo architecto minima natus quam. Nesciunt voluptate tempora dignissimos officia.,171,2023-02-04 06:25:00
32,304,Dp Kendaraan Eksterior Harga Interior,276000000,Vitae beatae odio porro rerum. Nemo nobis doloribus voluptatum excepturi ducimus fugit.,55,2023-01-22 11:54:11
33,118,Service Jual Pemakaian Kendaraan Eksterior,650000000,Recusandae libero deleniti. Laborum culpa officiis ducimus laudantium. Iste esse accusantium dolore eveniet aliquid. Quos velit earum facilis quas voluptatibus.,61,2022-11-22 21:01:30
34,332,Negotiable Jarang Bekas Interior Berkualitas Murah Siap,4650000000,Voluptas alias voluptatem adipisci. Quis quam vero omnis delectus a aperiam optio.,36,2022-08-30 13:22:09
35,54,Asli Cash Berkualitas Velg Kilometer Warna Dokumen Bekas Jarang Cicilan,110000000,Dignissimos neque odit deleniti. Consectetur iure expedita numquam.,116,2023-04-10 15:15:45
36,241,Pajak Oli Pribadi Tangan Dokumen Pakai,775000000,Quisquam repellendus ipsum similique dolores eum. Odit sit ab distinctio quibusdam doloremque. Doloremque esse amet laudantium autem.,133,2023-04-16 02:54:50
37,280,Cat Pemakaian Warna Bukan rental Ban Stnk,860000000,Accusantium mollitia ipsam corrupti fugit et. Qui quis laboriosam amet.,67,2023-05-09 16:18:01
38,323,Km Pakai Jarak Surat Eksterior Cicilan Pajak Terjamin Jual Kendaraan,155000000,Facere voluptas debitis molestias at. Hic eos voluptatem laudantium nihil. Nulla atque accusamus ex fugit tempore ipsa.,17,2022-08-29 08:22:22
39,169,Bukan rental Warna Dp Ban Mobil Interior Cat,825000000,Eum officia ullam labore deserunt. Laboriosam quaerat autem voluptatem. Commodi adipisci esse ratione.,141,2022-11-22 07:14:30
40,15,Oli Ban Bekas Velg Terawat Mobil Murah,180000000,Aperiam magni perspiciatis magni ab eligendi. Vitae impedit eveniet libero accusantium.,105,2023-01-28 07:03:23
41,270,Jarak Siap Cicilan Berkualitas Pribadi Cash Kredit Terawat Harga Kondisi,100000000,Natus quidem sunt voluptate quo laudantium. Dignissimos atque sunt sapiente nemo doloremque maxime. Aut eligendi blanditiis.,188,2022-11-01 18:41:46
42,4,Velg Pakai Warna Mulus Original Km Cash Oli Kilometer Terjamin,517000000,Recusandae veritatis voluptatibus rerum quae voluptas sapiente inventore. Quasi voluptates similique molestiae. Ut asperiores delectus iure.,65,2023-05-01 20:33:14
43,67,Murah Kendaraan Service Interior Nopol Pajak Pakai Berkualitas Cat Dp,590000000,Vel deserunt sed animi esse. Esse assumenda minima accusamus accusamus. Magnam in eos eveniet harum laboriosam perferendis maxime.,139,2022-12-15 15:29:04
44,328,Interior Jual Mobil Jarak Cicilan Terjamin,500000000,Laboriosam dolorum delectus laudantium sit deleniti aut odio. Deserunt commodi omnis explicabo officiis ratione quisquam.,123,2022-10-06 15:22:10
45,17,Mulus Mesin Service Surat Cicilan,110000000,Quis ullam expedita nostrum culpa atque ducimus. Dolores dolor accusantium eveniet rem temporibus error. Reprehenderit quos eligendi sapiente aspernatur.,117,2023-02-22 04:32:48
46,302,Mobil Mulus Pemakaian Surat Terawat Tahun Pakai Siap Oli Stnk,325000000,Soluta incidunt blanditiis iusto voluptatem. Earum quaerat sequi cupiditate ipsa repellendus eius.,21,2023-06-07 20:59:11
47,96,Surat Harga Mulus Warna Jual Mobil Langsung Cat Kilometer Kendaraan,197000000,Adipisci explicabo maiores. Molestiae dolorum molestias illo placeat. Consectetur sint voluptas laudantium ut eveniet iste.,108,2023-03-12 17:27:21
48,372,Kondisi Jarang Bekas Cicilan Velg Pribadi Kendaraan Stnk Jual Full,135000000,Veniam nulla neque mollitia impedit tenetur.,185,2023-07-11 14:18:47
49,369,Jarak Kredit Full Nopol Bukan rental Baru Surat Jual,127000000,Excepturi perspiciatis perferendis aut consequatur natus quibusdam animi. Doloremque corporis accusantium alias doloribus quod deleniti.,117,2022-11-04 13:27:07
50,329,Pajak Bukan rental Harga Bekas Jual Warna Siap Original Tahun Mesin,260000000,Nemo aliquid dicta rem. Quaerat quia beatae consectetur minus non velit. Officia minima eius sit at hic omnis quibusdam.,200,2022-08-14 17:22:53
51,386,Cicilan Oli Jarang Warna Mesin Berkualitas Nopol,230000000,Nemo deserunt assumenda accusantium et fuga nulla. Exercitationem eveniet error optio quaerat.,31,2023-01-30 08:38:57
52,316,Kilometer Kendaraan Service Tahun Km,100000000,Sit dignissimos ut ipsam quibusdam possimus deleniti. Tempore eum nulla illo eum eius dignissimos voluptate. Repellat dignissimos vitae exercitationem explicabo excepturi ullam assumenda.,188,2023-04-01 03:28:33
53,399,Jual Mulus Tahun Berkualitas Dp,197000000,Voluptate temporibus optio rem soluta nobis. Ullam cumque nesciunt qui animi eum.,101,2023-04-08 15:38:32
54,326,Baru Pajak Dokumen Surat Kendaraan Bukan rental Pemakaian Cicilan Jual,245000000,Omnis incidunt eos quas. Quas totam beatae iure modi magni. Laborum error veniam quo natus quam dolorem maiores.,144,2023-03-21 00:08:04
55,353,Interior Pribadi Mobil Jarak Bekas Km Dp Baru Full Pajak,1950000000,Exercitationem magnam consequatur dolor.,107,2023-01-20 21:01:45
56,74,Pakai Cicilan Murah Mobil Tangan Terjamin Cash Kendaraan Original,159000000,Possimus mollitia quasi amet velit doloribus. Incidunt itaque error itaque.,163,2022-11-03 05:34:11
57,331,Dokumen Original Pajak Murah Cicilan,185000000,Provident iure magni officiis ducimus occaecati magni. Voluptatibus totam unde. Officia saepe corporis suscipit optio nostrum sint.,28,2023-07-04 08:39:16
58,305,Terjamin Original Surat Pakai Mobil Pribadi Warna Jarak Jual,1650000000,Cum ipsum sequi fugiat eaque aliquam autem id. Dolor repellendus aliquam minus labore facere consequuntur.,138,2023-03-09 21:30:27
59,66,Surat Pemakaian Mulus Pakai Original Km Interior Tangan,775000000,Iste ea dignissimos quos sunt culpa. Eligendi excepturi explicabo voluptas ab est fuga. Perferendis nesciunt voluptatem sapiente.,160,2023-02-07 16:43:37
60,296,Baru Nopol Nego Ban Mesin Km,95000,Temporibus ut nostrum. Ipsam dolorem tempore minus ut itaque numquam totam.,14,2023-06-18 23:59:25
61,202,Stnk Pajak Negotiable Cash Warna Km Dp Mesin Terawat Original,380000000,Fugit exercitationem molestiae eos harum. Distinctio nemo eveniet quo harum. Eum numquam harum corporis a quae doloribus quaerat.,198,2023-01-15 14:42:53
62,78,Original Berkualitas Negotiable Mulus Siap Kondisi Harga Service Murah Stnk,123000000,Ullam numquam assumenda veniam. Velit alias a vitae quam officia voluptatum.,118,2023-01-19 03:46:02
63,353,Dp Warna Jarang Harga Cat Kendaraan Service,300000000,Minus quis natus vitae. Cum eum modi accusantium voluptatum quae.,153,2023-02-21 04:58:28
64,282,Kendaraan Interior Terawat Eksterior Pajak Warna,181000000,Inventore voluptatum omnis rem suscipit sit amet consequuntur. Ex necessitatibus perspiciatis quidem.,168,2023-05-06 06:12:50
65,375,Langsung Service Interior Full Negotiable,500000000,Repudiandae consectetur modi officiis quod id cum. Ipsum totam aliquid ab vel. Provident iste dolores earum rem voluptatum quos.,13,2023-03-12 12:06:11
66,137,Kendaraan Service Original Pemakaian Mesin,155000000,Exercitationem minima beatae sint. Optio eius blanditiis nesciunt nemo. Asperiores laborum laudantium. Totam enim distinctio ex unde.,113,2022-08-20 22:41:02
67,112,Ban Negotiable Cicilan Tangan Km Pribadi Pemakaian,100000000,Pariatur ipsum impedit deleniti aperiam odio. Illum magni aliquid hic dolorem explicabo ducimus. Sit dolore voluptas.,47,2023-04-21 13:23:19
68,32,Jual Siap Tangan Langsung Terawat Cat Cash Km Tahun,155000000,Soluta iusto dolorem consequuntur natus. Tenetur molestiae occaecati quaerat modi veniam officia odit. Facilis iste minima.,131,2023-07-18 07:24:36
69,124,Harga Mesin Cash Negotiable Eksterior Asli Terawat Bekas,110000000,Molestiae voluptatum animi debitis neque nisi. Quas nemo quidem temporibus laborum ratione tempora sunt.,187,2023-05-29 03:33:14
70,305,Pribadi Tahun Mesin Interior Oli Baru Nopol Jual,819000000,Excepturi minima enim explicabo. Repudiandae nisi enim aperiam quisquam labore fugit.,199,2023-04-12 13:29:42
71,55,Full Interior Kendaraan Pakai Kilometer Surat,1075000000,Architecto minima doloribus perspiciatis nam maiores a. Rerum veritatis aut eius. Quod earum pariatur at quos.,94,2022-10-05 07:12:26
72,329,Kondisi Cicilan Pribadi Kendaraan Dp,600000000,Mollitia reprehenderit corrupti. Ut ipsum voluptate hic.,74,2023-04-24 10:09:37
73,63,Warna Pakai Eksterior Siap Stnk Dokumen Cash Kredit Pemakaian,1100000000,Nisi fugiat quidem voluptatem nesciunt accusantium perspiciatis corporis.,64,2022-09-27 12:20:30
74,382,Oli Berkualitas Pajak Cicilan Pemakaian Nopol Asli,159000000,Optio voluptates impedit incidunt nesciunt vel temporibus. Atque voluptatibus maiores consequatur nam nobis. Ea fuga iure impedit dignissimos eum assumenda. In magnam eligendi eligendi dicta cum perspiciatis.,39,2023-02-13 13:46:50
75,96,Murah Kendaraan Langsung Negotiable Pemakaian Nego Terjamin Velg Warna,159000000,Voluptas debitis earum molestias. Velit numquam perferendis dolorum qui facilis recusandae. Minima eos mollitia eaque numquam inventore aspernatur unde.,165,2023-02-03 11:58:42
76,6,Kredit Terjamin Pakai Nopol Cicilan Mobil Dp Pribadi Mulus Jarak,850000000,Expedita error explicabo eius laudantium. Impedit consectetur dolorum illum neque omnis consequuntur. Totam iste odit vel esse reiciendis aliquam.,2,2023-02-20 19:52:39
77,42,Service Original Eksterior Dokumen Nopol Ban Jarak,107000000,Eveniet laborum minima cum quo consequuntur.,18,2023-07-29 20:23:06
78,382,Pakai Pribadi Harga Terjamin Pemakaian,100000000,Esse animi dicta dolorem. Placeat minima veritatis accusamus doloribus harum. Esse beatae qui error minima incidunt occaecati.,188,2023-04-17 22:35:54
79,89,Pemakaian Murah Dokumen Velg Tahun Nego Negotiable Asli,110000000,Deleniti qui ut voluptate suscipit. Tenetur doloremque minima est.,116,2023-07-08 05:25:53
80,206,Km Langsung Siap Kilometer Cicilan Jarang Negotiable,825000000,Nam voluptas numquam reprehenderit assumenda fugit qui. Accusamus quasi possimus praesentium eos consequatur. Culpa velit magni voluptate.,175,2022-10-31 03:24:29
81,159,Bukan rental Cat Berkualitas Original Service,154000000,Tempora voluptatum facilis inventore optio quam dignissimos temporibus. Perferendis laudantium reprehenderit.,86,2022-12-27 11:57:22
82,61,Mobil Jual Original Nopol Kondisi Pemakaian Service Eksterior Velg Pakai,520000000,Perferendis libero suscipit omnis itaque. Culpa itaque nisi. Amet vitae error aut reiciendis quod explicabo excepturi.,62,2023-01-10 15:50:29
83,88,Km Eksterior Terawat Tahun Velg Mobil Interior Pemakaian,147500000,Eos voluptatem soluta blanditiis. Illum neque corrupti aliquam suscipit.,117,2023-04-05 07:45:51
84,377,Tangan Oli Stnk Dokumen Mesin Cicilan,297000000,Nihil itaque neque totam nesciunt tempore. Suscipit neque mollitia placeat sunt iure.,139,2023-01-16 20:10:23
85,138,Dokumen Pemakaian Original Km Jual Tangan Bekas Siap Mulus Langsung,200000000,Est iusto dolorum eaque similique delectus magnam. Quidem error veritatis voluptate neque debitis dolorum. Sint impedit molestias beatae eaque. Id vel harum aliquid.,44,2023-07-19 09:08:47
86,145,Interior Berkualitas Surat Velg Terjamin Mesin Langsung Jarang Service Original,1450000000,Quos corporis nostrum omnis rerum. Enim itaque dolore dignissimos accusantium dolor asperiores. Occaecati quae natus sint animi similique perferendis.,128,2023-06-13 06:30:24
87,131,Mesin Nego Eksterior Ban Mobil Kilometer Original,380000000,A incidunt voluptatem doloribus aut iste. Enim dolores consequatur quidem. Et magnam dolor reprehenderit fugit dignissimos eius necessitatibus.,124,2022-11-28 09:18:02
88,130,Cicilan Terjamin Warna Jarang Terawat,100000000,Fugiat blanditiis amet rerum odit corporis. Tenetur maiores vel laboriosam velit. Numquam animi blanditiis quaerat culpa.,118,2023-03-26 20:58:18
89,301,Jarang Asli Tangan Dp Full Harga Bekas Stnk Oli Pajak,253000000,Consequatur odit autem vel. Sed praesentium veniam voluptatum laborum quisquam aspernatur. Necessitatibus neque unde autem dignissimos minima illum. Temporibus incidunt labore maxime voluptates quod reiciendis facere.,179,2022-12-23 10:00:45
90,99,Bukan rental Velg Murah Jarang Jual Stnk Oli,159000000,Esse necessitatibus aperiam rerum architecto. Libero minima quisquam harum vitae consequuntur neque. Provident atque facere sapiente ratione. Necessitatibus occaecati tempore mollitia itaque consectetur.,15,2023-02-20 16:02:29
91,48,Kilometer Tangan Berkualitas Cat Negotiable Terjamin Interior,850000000,Et veniam quia corrupti totam error. Exercitationem dolorem sapiente quisquam culpa et. Ratione consectetur dolore corporis.,129,2022-08-31 04:16:18
92,225,Terawat Kredit Langsung Jarak Tahun Asli,1950000000,Accusamus error qui voluptates. Quia a neque perspiciatis officiis architecto aperiam.,154,2023-04-25 14:11:56
93,16,Mulus Terawat Kredit Mobil Cash Tangan Jarak,225000000,Quis praesentium deleniti adipisci odio architecto. Quos aut sapiente voluptate.,112,2023-06-30 03:25:50
94,348,Tahun Mobil Murah Jarang Berkualitas Cash Terjamin Asli,125000000,Incidunt rerum quod pariatur. Cum quis sed deserunt quam aliquam cumque.,71,2022-10-11 03:55:46
95,229,Negotiable Pakai Warna Harga Kendaraan Bukan rental,800000000,Aperiam nulla autem sint beatae beatae. Corrupti sed repellat neque reiciendis. Quis itaque accusantium at expedita maiores.,191,2023-01-29 19:33:17
96,2,Bekas Km Nopol Jarang Kilometer Ban Jarak Kredit Pajak Dp,260000000,Asperiores nam quasi at hic voluptate voluptatibus eius. Consectetur minima veniam velit.,35,2022-10-30 20:44:59
97,140,Tahun Mesin Terawat Pakai Service Cash Terjamin,190000000,Ipsam incidunt nobis ea. Fuga possimus distinctio inventore asperiores.,16,2022-12-29 23:52:50
98,93,Kilometer Tahun Tangan Negotiable Km,228000000,Dolores dolore maiores maiores. Vitae vero vero unde aperiam reprehenderit.,137,2023-05-04 18:00:30
99,102,Siap Km Warna Surat Stnk,590000000,Iste qui quae nam. Temporibus labore maxime ipsa. Porro quod voluptate perferendis quos.,91,2023-05-13 09:54:53
100,111,Tahun Cat Siap Jarak Original Berkualitas Kilometer Mesin Bukan rental,398000000,Consequuntur accusantium magnam. Quidem architecto cupiditate.,59,2023-03-20 12:38:40
101,119,Original Pemakaian Nego Jarak Pakai,825000000,Ullam dolore voluptate blanditiis unde velit.,133,2023-03-20 10:38:49
102,10,Surat Velg Stnk Full Kredit Km Pajak Pemakaian Cat,1295000000,Saepe perferendis consequatur non excepturi cupiditate occaecati.,100,2023-07-21 12:52:56
103,363,Harga Berkualitas Cat Kilometer Asli Original,199000000,Harum tenetur perspiciatis sint totam minus repudiandae. Autem necessitatibus delectus repellendus at nisi alias. Sint voluptatibus aperiam minus eligendi expedita quia quo.,104,2023-04-01 17:08:59
104,160,Nopol Ban Mulus Negotiable Asli Pajak Berkualitas Cicilan Service Dp,159000000,Rerum ut laborum voluptatem illo. Cum velit facilis sunt odit fuga earum.,47,2023-08-03 05:25:59
105,252,Asli Original Langsung Kendaraan Dp Berkualitas Mobil,110000000,Doloremque similique magni minus. Odit ab perspiciatis officia impedit sapiente incidunt maxime. Quidem odio esse molestias hic maxime.,85,2022-12-31 00:56:18
106,358,Asli Cat Baru Original Siap Dp,1845000000,Et eveniet distinctio sed id commodi. Maxime perspiciatis harum porro.,45,2022-12-28 19:00:19
107,119,Pajak Bekas Harga Pakai Oli,500000000,Quaerat optio cum adipisci doloribus praesentium. Provident consequatur corrupti quasi voluptate ipsam labore. Voluptatem magni autem explicabo.,90,2023-05-04 12:49:43
108,79,Bukan rental Surat Tangan Ban Oli Cat Murah Harga Bekas,517000000,Ad vitae hic recusandae recusandae illo enim. Laboriosam totam ab quaerat corporis. Impedit veniam tenetur.,166,2022-09-15 07:59:40
109,36,Tangan Bukan rental Harga Pakai Murah Kendaraan Surat Original Langsung Cicilan,127000000,Tempora magni rem excepturi quae velit. Voluptatibus reprehenderit ratione distinctio sapiente architecto quae. Quibusdam inventore nostrum iusto.,85,2022-10-09 23:33:49
110,149,Pajak Berkualitas Kondisi Velg Service Mulus,450000000,Culpa veritatis eum quaerat temporibus quia tenetur ducimus. Eaque voluptate tempore ex maiores. Dolorum itaque repellat a quibusdam ipsa perspiciatis minima.,198,2023-02-04 02:41:17
111,352,Surat Pribadi Dp Nopol Jual Oli Bekas Asli,463000000,Unde accusantium expedita explicabo. Saepe commodi molestiae nostrum optio.,197,2022-12-01 16:10:14
112,394,Kondisi Tahun Murah Cicilan Oli Pribadi,123000000,Corporis tenetur tempore veritatis placeat dolor id officia. Officia odit natus soluta nam. Officiis provident voluptas delectus nisi incidunt.,1,2023-05-06 10:10:28
113,263,Jarak Nego Oli Negotiable Kredit Pakai Mulus Bekas Surat,300000000,Architecto laboriosam possimus dolor sequi ipsa reprehenderit dolore. Quia labore quia ipsam nisi harum.,42,2022-10-31 06:08:52
114,84,Kendaraan Kilometer Nego Mulus Terawat Warna Surat,185000000,Quasi aliquam dignissimos assumenda. Corrupti eius eum quia sed amet voluptatum.,28,2023-01-20 10:44:42
115,190,Km Kilometer Bukan rental Terjamin Dp Terawat Berkualitas,190000000,Animi ea rem totam. Quos ratione quo doloremque sequi dicta.,63,2023-04-29 23:12:40
116,214,Original Mulus Terjamin Pajak Harga Nopol Kondisi Murah Velg,975000000,Nihil ut id error eum tempore. Illum accusantium corrupti facere dolores.,127,2023-04-20 01:24:23
117,279,Warna Ban Harga Bukan rental Kendaraan Tangan,112000,Soluta quae velit numquam eaque ea. Necessitatibus maxime consequatur accusantium perferendis.,18,2023-06-19 12:44:31
118,66,Mulus Asli Velg Pajak Jarang Tangan Surat,147500000,Pariatur id eveniet quidem beatae. Nisi mollitia saepe necessitatibus. Eum dolorum quia dolore.,187,2022-11-09 12:36:59
119,326,Original Langsung Pajak Ban Km Bekas,200000000,Rerum quisquam maxime nostrum. Excepturi deleniti distinctio mollitia.,112,2023-01-24 17:53:46
120,244,Original Bekas Jarak Terjamin Service Baru Interior Terawat Dp,181000000,Eaque modi quaerat voluptatibus ad illo. Repellat totam fuga harum. Officia dignissimos voluptates blanditiis sunt iste iusto.,103,2022-11-08 15:49:30
121,76,Tangan Terawat Cash Cat Warna Nopol Bukan rental Baru Siap,127000000,Dolore qui facere incidunt quod a atque. Nihil delectus libero molestias fugit.,83,2023-04-24 12:07:19
122,228,Pribadi Cicilan Nego Terawat Ban Jual,120000000,Quisquam odit deserunt autem minus esse maiores. Tenetur cupiditate occaecati magnam a ad assumenda. Harum doloribus eligendi nulla architecto incidunt.,101,2023-07-22 04:28:07
123,33,Jual Nopol Berkualitas Tahun Asli,450000000,Ipsa officiis ratione a rem cumque. Eveniet cumque suscipit quibusdam.,124,2023-06-15 19:03:38
124,137,Kondisi Langsung Mesin Tangan Full,445000000,Maxime amet corporis. Fuga quaerat at doloremque quisquam atque sunt. Dignissimos quam aperiam veniam nemo.,78,2023-03-25 00:28:41
125,235,Oli Asli Kendaraan Cash Eksterior Mulus,440000000,Esse explicabo facilis. Consequuntur animi neque dolor.,21,2022-10-24 03:15:49
126,268,Pajak Pakai Stnk Siap Dokumen Langsung Full Terjamin Cicilan Baru,180000000,Id ipsam atque delectus. Facere magnam provident minus sequi incidunt.,66,2023-02-06 09:50:43
127,31,Cat Dokumen Murah Full Cicilan Surat Terawat,127000000,Cum et nam ipsam magnam rem. Ipsum nam commodi voluptatibus porro quod quam.,135,2022-11-07 10:52:36
128,83,Mesin Pajak Dokumen Terjamin Nego Bukan rental Kendaraan Km Kilometer Velg,210000000,Cumque ducimus accusamus natus amet minima aut. Doloremque excepturi aut corrupti quo. Consequuntur neque asperiores repellendus suscipit.,106,2023-05-09 16:51:22
129,23,Mulus Ban Kilometer Asli Full Jual Dokumen Siap Oli Service,110000000,Dolor modi totam. Nesciunt nobis omnis vel voluptatem molestias. Placeat praesentium excepturi iste itaque libero laudantium velit. Sint sapiente esse harum debitis mollitia dicta.,56,2022-11-10 18:46:05
